Category,Message
ham,I am back. Bit long cos of accident on a30. Had to divert via wadebridge.I had a brilliant weekend thanks. Speak soon. Lots of love
ham,Hmm .. Bits and pieces lol ... *sighs* ...
ham,"I shall book chez jules for half eight, if that's ok with you?"
ham,But I'm on a diet. And I ate 1 too many slices of pizza yesterday. Ugh I'm ALWAYS on a diet.
ham,Hey morning what you come to ask:-) pa...
ham,I love to give massages. I use lots of baby oil... What is your fave position?
ham,True lov n care wil nevr go unrecognized. though somone often makes mistakes when valuing it. but they will definitly undrstnd once when they start missing it.
ham,Guessin you ain't gonna be here before 9?
ham,Do u noe how 2 send files between 2 computers?
ham,Den wat will e schedule b lk on sun?
ham,make that 3! 4 fucks sake?! x
ham,First has she gained more than  &lt;#&gt; kg since she took in. Second has she done the blood sugar tests. If she has and its ok and her blood pressure is within normal limits then no worries
ham,"My life Means a lot to me, Not because I love my life, But because I love the people in my life, The world calls them friends, I call them my World:-).. Ge:-).."
ham,When you are big..| God will bring success.
ham,"Hey babe, my friend had to cancel, still up for a visit ?"
ham,Great. Hope you are using your connections from mode men also cos you can never know why old friends can lead you to today
ham,No chikku nt yet.. Ya i'm free
ham,Text her. If she doesnt reply let me know so i can have her log in
spam,"URGENT! Your Mobile No was awarded a £2,000 Bonus Caller Prize on 1/08/03! This is our 2nd attempt to contact YOU! Call 0871-4719-523 BOX95QU BT National Rate"
ham,"Piggy, r u awake? I bet u're still sleeping. I'm going 4 lunch now..."
ham,They said ü dun haf passport or smth like dat.. Or ü juz send to my email account..
ham,What you did in  leave.
ham,Yar i wanted 2 scold u yest but late already... I where got zhong se qing you? If u ask me b4 he ask me then i'll go out w u all lor. N u still can act so real.
ham,Hope this text meets you smiling. If not then let this text give you a reason to smile. Have a beautiful day.
ham,"Just sent you an email – to an address with incomm in it, is that right?"
ham,Staff of placement training in Amrita college.
spam,1st wk FREE! Gr8 tones str8 2 u each wk. Txt NOKIA ON to 8007 for Classic Nokia tones or HIT ON to 8007 for Polys. Nokia/150p Poly/200p 16+
ham,Yup... Ok i go home look at the timings then i msg ü again... Xuhui going to learn on 2nd may too but her lesson is at 8am
ham,All boys made fun of me today. Ok i have no problem. I just sent one message just for fun
ham,Oic... I saw him too but i tot he din c me... I found a group liao...
spam,PRIVATE! Your 2003 Account Statement for shows 800 un-redeemed S.I.M. points. Call 08715203685 Identifier Code:4xx26 Expires 13/10/04
ham,LOL ... Have you made plans for new years?
spam,"Sunshine Hols. To claim ur med holiday send a stamped self address envelope to Drinks on Us UK, PO Box 113, Bray, Wicklow, Eire. Quiz Starts Saturday! Unsub Stop"
ham,It's ok i noe u're busy but i'm really too bored so i msg u. I oso dunno wat colour she choose 4 me one.
ham,First answer my question.
ham,Kent vale lor... Ü wait 4 me there ar?
ham,1's reach home call me.
ham,Nothing spl..wat abt u and whr ru?
ham,"Yalru lyfu astne chikku.. Bt innu mundhe lyf ali halla ke bilo (marriage)program edhae, so lyf is nt yet ovr chikku..ali vargu lyfu meow meow:-D"
ham,Where r e meeting tmr?
ham,Ya i knw u vl giv..its ok thanks kano..anyway enjoy wit ur family wit 1st salary..:-);-)
ham,That's y we haf to combine n c how lor...
ham,Honey boo I'm missing u.
ham,She's good. How are you. Where r u working now
ham,Pls dont forget to study
spam,"Do you realize that in about 40 years, we'll have thousands of old ladies running around with tattoos?"
ham,"FRAN I DECIDED 2 GO N E WAY IM COMPLETELY BROKE AN KNACKERED I GOT UP BOUT 3 C U 2MRW LOVE JANX P.S THIS IS MY DADS FONE, -NO CREDIT"
ham,"Pls send me a comprehensive mail about who i'm paying, when and how much."
ham,Early bird! Any purchases yet?
ham,"&lt;#&gt; , that's all? Guess that's easy enough"
ham,Hey tmr meet at bugis 930 ?
ham,Dai what this da.. Can i send my resume to this id.
ham,Lol yes. Our friendship is hanging on a thread cause u won't buy stuff.
ham,"7 wonders in My WORLD 7th You 6th Ur style 5th Ur smile 4th Ur Personality 3rd Ur Nature 2nd Ur SMS and 1st ""Ur Lovely Friendship""... good morning dear"
spam,"TheMob>Hit the link to get a premium Pink Panther game, the new no. 1 from Sugababes, a crazy Zebra animation or a badass Hoody wallpaper-all 4 FREE!"
ham,But that's on ebay it might be less elsewhere.
ham,"A cute thought for friendship: ""Its not necessary to share every secret with ur close Frnd, but watever u shared should be true""...."
ham,I want to tel u one thing u should not mistake me k THIS IS THE MESSAGE THAT YOU SENT:)
ham,Yup song bro. No creative. Neva test quality. He said check review online.
ham,Boooo you always work. Just quit.
ham,"Yeah I am, so I'll leave maybe 7ish?"
ham,Let me know how it changes in the next 6hrs. It can even be appendix but you are out of that age range. However its not impossible. So just chill and let me know in 6hrs
ham,And pls pls drink plenty plenty water
ham,Its normally hot mail. Com you see!
ham,"I get out of class in bsn in like  &lt;#&gt;  minutes, you know where advising is?"
ham,Were trying to find a Chinese food place around here
ham,Hey i booked the kb on sat already... what other lessons are we going for ah? Keep your sat night free we need to meet and confirm our lodging
ham,Cos daddy arranging time c wat time fetch ü mah...
ham,Hey. For me there is no leave on friday. Wait i will ask my superior and tell you..
ham,Becoz its  &lt;#&gt;  jan whn al the post ofice is in holiday so she cn go fr the post ofice...got it duffer
ham,You still at the game?
ham,"Sir, I am waiting for your mail."
ham,Prakesh is there know.
ham,Dunno i juz askin cos i got a card got 20% off 4 a salon called hair sense so i tot it's da one ü cut ur hair.
ham,I bought the test yesterday. Its something that lets you know the exact day u ovulate.when will get 2u in about 2 to 3wks. But pls pls dont fret. I know u r worried. Pls relax. Also is there anything in ur past history u need to tell me?
ham,"It'll be tough, but I'll do what I have to"
ham,Tomorrow i am not going to theatre. . . So i can come wherever u call me. . . Tell me where and when to come tomorrow
ham,Are you willing to go for aptitude class.
spam,Ur cash-balance is currently 500 pounds - to maximize ur cash-in now send CASH to 86688 only 150p/msg. CC: 08718720201 PO BOX 114/14 TCR/W1
ham,I dont know exactly could you ask chechi.
ham,Ok. C u then.
ham,Anytime lor...
ham,My uncles in Atlanta. Wish you guys a great semester.
ham,Thanx a lot 4 ur help!
ham,I am going to sleep. I am tired of travel.
ham,"Wait that's still not all that clear, were you not sure about me being sarcastic or that that's why x doesn't want to live with us"
ham,Ugh just got outta class
spam,Moby Pub Quiz.Win a £100 High Street prize if u know who the new Duchess of Cornwall will be? Txt her first name to 82277.unsub STOP £1.50 008704050406 SP
ham,somewhere out there beneath the pale moon light someone think in of u some where out there where dreams come true... goodnite &amp; sweet dreams
spam,Want explicit SEX in 30 secs? Ring 02073162414 now! Costs 20p/min
ham,Oh and by the way you do have more food in your fridge! Want to go out for a meal tonight?
ham,No. Yes please. Been swimming?
ham,My sort code is  and acc no is . The bank is natwest. Can you reply to confirm i've sent this to the right person!
ham,"Yo, you gonna still be in stock tomorrow/today? I'm trying to get a dubsack"
ham,Shall i come to get pickle
ham,Ok i will tell her to stay out. Yeah its been tough but we are optimistic things will improve this month.
ham,Tomarrow i want to got to court. At  &lt;DECIMAL&gt; . So you come to bus stand at 9.
ham,"Y cant u try new invention to fly..i'm not joking.,"
ham,Stop calling everyone saying I might have cancer. My throat hurts to talk. I can't be answering everyones calls. If I get one more call I'm not babysitting on Monday
spam,Cashbin.co.uk (Get lots of cash this weekend!) www.cashbin.co.uk Dear Welcome to the weekend We have got our biggest and best EVER cash give away!! These..
ham,"No, but you told me you were going, before you got drunk!"
spam,TheMob>Yo yo yo-Here comes a new selection of hot downloads for our members to get for FREE! Just click & open the next link sent to ur fone...
ham,Now only i reached home. . . I am very tired now. . I will come tomorro
ham,I am getting threats from your sales executive Shifad as i raised complaint against him. Its an official message.
spam,FROM 88066 LOST £12 HELP
ham,I'm in chennai velachery:)
ham,Idk. I'm sitting here in a stop and shop parking lot right now bawling my eyes out because i feel like i'm a failure in everything. Nobody wants me and now i feel like i'm failing you.
ham,"Superb Thought- ""Be grateful that u dont have everything u want. That means u still have an opportunity to be happier tomorrow than u are today."":-)"
spam,IMPORTANT INFORMATION 4 ORANGE USER 0796XXXXXX. TODAY IS UR LUCKY DAY!2 FIND OUT WHY LOG ONTO http://www.urawinner.com THERE'S A FANTASTIC PRIZEAWAITING YOU!
ham,Oh wow thats gay. Will firmware update help
ham,"Carlos is down but I have to pick it up from him, so I'll swing by usf in a little bit"
spam,"This is the 2nd time we have tried 2 contact u. U have won the £750 Pound prize. 2 claim is easy, call 087187272008 NOW1! Only 10p per minute. BT-national-rate."
spam,Want a new Video Phone? 750 anytime any network mins? Half price line rental free text for 3 months? Reply or call 08000930705 for free delivery
ham,Friends that u can stay on fb chat with
ham,Yes when is the appt again?
ham,Then ü come n pick me at 530 ar?
spam,"0A$NETWORKS allow companies to bill for SMS, so they are responsible for their ""suppliers"", just as a shop has to give a guarantee on what they sell. B. G."
ham,I'm on da bus going home...
ham,I want  &lt;#&gt;  rs da:)do you have it?
ham,I enjoy watching and playing football and basketball. Anything outdoors. And you?
ham,Horrible bf... I now v hungry...
ham,When u love someone Dont make them to love u as much as u do. But Love them so much that they dont want to be loved by anyone except you... Gud nit.
ham,"Not sure yet, still trying to get a hold of him"
ham,Oh yeah clearly it's my fault
ham,"Aight will do, thanks again for comin out"
ham,What should i eat fo lunch senor
ham,"Like  &lt;#&gt; , same question"
spam,GSOH? Good with SPAM the ladies?U could b a male gigolo? 2 join the uk's fastest growing mens club reply ONCALL. mjzgroup. 08714342399.2stop reply STOP. msg@£1.50rcvd
ham,I'll talk to the others and probably just come early tomorrow then
ham,I'm e person who's doing e sms survey...
ham,Did you try making another butt.
ham,"K I'm ready,  &lt;#&gt; ?"
spam,The current leading bid is 151. To pause this auction send OUT. Customer Care: 08718726270
ham,Aww you must be nearly dead!Well Jez isComing over toDo some workAnd that whillTake forever!
ham,Lol! Nah wasn't too bad thanks. Its good to b home but its been quite a reality check. Hows ur day been? Did u do anything with website?
ham,Aight well keep me informed
spam,Moby Pub Quiz.Win a £100 High Street prize if u know who the new Duchess of Cornwall will be? Txt her first name to 82277.unsub STOP £1.50 008704050406 SP Arrow
ham,Okay same with me. Well thanks for the clarification
ham,I'm wif him now buying tix lar...
ham,Play w computer? Aiyah i tok 2 u lor?
ham,"Fighting with the world is easy, u either win or lose bt fightng with some1 who is close to u is dificult if u lose - u lose if u win - u still lose."
ham,Dear we are going to our rubber place
ham,Now that you have started dont stop. Just pray for more good ideas and anything i see that can help you guys i.ll forward you a link.
ham,"Hey ! I want you ! I crave you ! I miss you ! I need you ! I love you, Ahmad Saeed al Hallaq ..."
ham,Oh did you charge camera
ham,I'm also came to room.
ham,Msgs r not time pass.They silently say that I am thinking of U right now and also making U think of me at least 4 a moment. Gd nt.swt drms @Shesil
ham,Just trying to figure out when I'm suppose to see a couple different people this week. We said we'd get together but I didn't set dates
ham,"Hey sexy buns ! Have I told you ? I adore you, loverboy. I hope you remember to thank your sister in law for those meatballs *grins* ... i love you, babe"
ham,You didnt complete your gist oh.
ham,I'm in inside office..still filling forms.don know when they leave me.
ham,Do we have any spare power supplies
ham,Thnx dude. u guys out 2nite?
ham,MY NO. IN LUTON 0125698789 RING ME IF UR AROUND! H*
ham,Do u noe wat time e place dat sells 4d closes?
ham,U should have made an appointment
ham,Then she dun believe wat?
ham,Customer place i will call you
ham,I jus reached home. I go bathe first. But my sis using net tell u when she finishes k...
ham,I would but I'm still cozy. And exhausted from last night.nobody went to school or work. Everything is closed.
ham,True dear..i sat to pray evening and felt so.so i sms'd you in some time...
ham,Today iZ Yellow rose day. If u love my frndship give me 1 misscall &amp; send this to ur frndZ &amp; See how many miss calls u get. If u get 6missed U marry ur Lover.
ham,"Painful words- ""I thought being Happy was the most toughest thing on Earth... But, the toughest is acting Happy with all unspoken pain inside.."""
ham,"Call me when you/carlos is/are here, my phone's vibrate is acting up and I might not hear texts"
ham,Hey i'm bored... So i'm thinking of u... So wat r u doing?
ham,Sorry. || mail? ||
ham,Ooooooh I forgot to tell u I can get on yoville on my phone
ham,"Not much, just some textin'. How bout you?"
ham,Lol where do u come up with these ideas?
ham,Pls give her prometazine syrup. 5mls then  &lt;#&gt; mins later feed.
ham,And of course you should make a stink!
ham,"Good afternoon, my love ... How goes your day ? How did you sleep ? I hope your well, my boytoy ... I think of you ..."
ham,Heehee that was so funny tho
ham,What you thinked about me. First time you saw me in class.
ham,HIYA STU WOT U UP 2.IM IN SO MUCH TRUBLE AT HOME AT MOMENT EVONE HATES ME EVEN U! WOT THE HELL AV I DONE NOW? Y WONT U JUST TELL ME TEXT BCK PLEASE LUV DAN
ham,Going on nothing great.bye
ham,Alright i have a new goal now
ham,She ran off with a younger man. we will make pretty babies together :)
ham,"that would be good … I'll phone you tomo lunchtime, shall I, to organise something?"
ham,Yoyyooo u know how to change permissions for a drive in mac. My usb flash drive
ham,"Em, its olowoyey@ usc.edu have a great time in argentina. Not sad about secretary, everything is a blessing"
ham,Please dont say like that. Hi hi hi
spam,"cmon babe, make me horny, *turn* me on! Txt me your fantasy now babe -) Im hot, sticky and need you now. All replies cost £1.50. 2 cancel send STOP"
ham,"Funny fact Nobody teaches volcanoes 2 erupt, tsunamis 2 arise, hurricanes 2 sway aroundn no 1 teaches hw 2 choose a wife Natural disasters just happens"
ham,Wat's da model num of ur phone?
ham,I calls you later. Afternoon onwords mtnl service get problem in south mumbai. I can hear you but you cann't listen me.
ham,CHEERS FOR CALLIN BABE.SOZI CULDNT TALKBUT I WANNATELL U DETAILS LATER WENWECAN CHAT PROPERLY X
ham,"I call you later, don't have network. If urgnt, sms me."
ham,And several to you sir.
ham,Am in film ill call you later.
ham,Ok anyway no need to change with what you said
ham,I'm stuck in da middle of da row on da right hand side of da lt...
ham,"Hiya , have u been paying money into my account? If so, thanks. Got a pleasant surprise when i checked my balance -u c, i don't get statements 4 that acc"
ham,There is no sense in my foot and penis.
ham,Jus ans me lar. U'll noe later.
ham,"Dear,shall mail tonite.busy in the street,shall update you tonite.things are looking ok.varunnathu edukkukayee raksha ollu.but a good one in real sense."
ham,I'm coming back on Thursday. Yay. Is it gonna be ok to get the money. Cheers. Oh yeah and how are you. Everything alright. Hows school. Or do you call it work now
ham,How have your little darlings been so far this week? Need a coffee run tomo?Can't believe it's that time of week already …
ham,That depends. How would you like to be treated? :)
ham,U still havent got urself a jacket ah?
ham,"Sweet, we may or may not go to 4U to meet carlos so gauge patty's interest in that"
ham,Can you let me know details of fri when u find out cos I'm not in tom or fri. mentionned chinese. Thanks
ham,"Thanks again for your reply today. When is ur visa coming in. And r u still buying the gucci and bags. My sister things are not easy, uncle john also has his own bills so i really need to think about how to make my own money. Later sha."
ham,All sounds good. Fingers . Makes it difficult to type
ham,Nope i waiting in sch 4 daddy...
ham,It will stop on itself. I however suggest she stays with someone that will be able to give ors for every stool.
ham,Dont know you bring some food
ham,"K, wen ur free come to my home and also tel vikky i hav sent mail to him also.. Better come evening il be free today aftr 6pm..:-)"
spam,PRIVATE! Your 2004 Account Statement for 07742676969 shows 786 unredeemed Bonus Points. To claim call 08719180248 Identifier Code: 45239 Expires
ham,"I dont knw pa, i just drink milk.."
spam,goldviking (29/M) is inviting you to be his friend. Reply YES-762 or NO-762 See him: www.SMS.ac/u/goldviking STOP? Send STOP FRND to 62468
ham,Got it. Seventeen pounds for seven hundred ml – hope ok.
ham,Ma head dey swell oh. Thanks for making my day
ham,"The guy at the car shop who was flirting with me got my phone number from the paperwork and called and texted me. I'm nervous because of course now he may have my address. Should i call his boss and tell him, knowing this may get him fired?"
ham,Do you like Italian food?
ham,Ü go home liao? Ask dad to pick me up at 6...
ham,That sucks. So what do you got planned for your yo valentine? I am your yo valentine aren't I?
spam,"You have won ?1,000 cash or a ?2,000 prize! To claim, call09050000327. T&C: RSTM, SW7 3SS. 150ppm"
ham,"Yo, call me when you get the chance, a friend of mine wanted me to ask you about a big order"
spam,"As a valued customer, I am pleased to advise you that following recent review of your Mob No. you are awarded with a £1500 Bonus Prize, call 09066368470"
ham,I'm in a movie... Collect car oredi...
ham,You have to pls make a note of all she.s exposed to. Also find out from her school if anyone else was vomiting. Is there a dog or cat in the house? Let me know later.
ham,Where is it. Is there any opening for mca.
ham,So how are you really. What are you up to. How's the masters. And so on.
ham,Yup... How ü noe leh...
ham,"Wen ur lovable bcums angry wid u, dnt take it seriously.. Coz being angry is d most childish n true way of showing deep affection, care n luv!.. kettoda manda... Have nice day da."
ham,Shopping lor. Them raining mah hard 2 leave orchard.
spam,New TEXTBUDDY Chat 2 horny guys in ur area 4 just 25p Free 2 receive Search postcode or at gaytextbuddy.com. TXT ONE name to 89693
spam,Call 09095350301 and send our girls into erotic ecstacy. Just 60p/min. To stop texts call 08712460324 (nat rate)
ham,K:)k.are you in college?
spam,Your B4U voucher w/c 27/03 is MARSMS. Log onto www.B4Utele.com for discount credit. To opt out reply stop. Customer care call 08717168528
ham,IM GONNA MISS U SO MUCH
ham,I am in bus on the way to calicut
ham,Jason says it's cool if we pick some up from his place in like an hour
ham,I'm at work. Please call
ham,"Thank you so much. When we skyped wit kz and sura, we didnt get the pleasure of your company. Hope you are good. We've given you ultimatum oh! We are countin down to aburo. Enjoy!"
ham,Draw va?i dont think so:)
ham,Lil fever:) now fine:)
ham,"G says you never answer your texts, confirm/deny"
ham,I only work from mon to thurs but Sat i cant leh... Booked liao... Which other day u free?
ham,Ugh I don't wanna get out of bed. It's so warm.
ham,"It doesnt make sense to take it there unless its free. If you need to know more, wikipedia.com"
ham,Yup no more already... Thanx 4 printing n handing it up.
ham,"Aight yo, dats straight dogg"
ham,Yes... I trust u to buy new stuff ASAP so I can try it out
ham,Spoons it is then okay?
ham,Shall i send that exe to your mail id.
ham,Y dun cut too short leh. U dun like ah? She failed. She's quite sad.
ham,Lol they don't know about my awesome phone. I could click delete right now if I want.
spam,PRIVATE! Your 2004 Account Statement for 078498****7 shows 786 unredeemed Bonus Points. To claim call 08719180219 Identifier Code: 45239 Expires 06.05.05
ham,"Kate jackson rec center before 7ish, right?"
ham,Ugh my leg hurts. Musta overdid it on mon.
ham,As per your request 'Maangalyam (Alaipayuthe)' has been set as your callertune for all Callers. Press *9 to copy your friends Callertune
ham,Should I be stalking u?
ham,Gimme a few was  &lt;#&gt;  minutes ago
ham,I'm job profile seems like bpo..
ham,He needs to stop going to bed and make with the fucking dealing
ham,Cheers for the card ... Is it that time of year already?
ham,I am great princess! What are you thinking about me? :)
spam,Congratulations ur awarded either a yrs supply of CDs from Virgin Records or a Mystery Gift GUARANTEED Call 09061104283 Ts&Cs www.smsco.net £1.50pm approx 3mins
ham,Hey r ü still online? I've finished the formatting...
ham,I'm done...
spam,"URGENT!: Your Mobile No. was awarded a £2,000 Bonus Caller Prize on 02/09/03! This is our 2nd attempt to contact YOU! Call 0871-872-9755 BOX95QU"
ham,Hey cutie. How goes it? Here in WALES its kinda ok. There is like hills and shit but i still avent killed myself.
ham,No problem. We will be spending a lot of quality time together...
ham,"Wa, ur openin sentence very formal... Anyway, i'm fine too, juz tt i'm eatin too much n puttin on weight...Haha... So anythin special happened?"
ham,"Aight, I'll text you when I'm back"
ham,Ü ready then call me...
ham,You know what hook up means right?
spam,Good Luck! Draw takes place 28th Feb 06. Good Luck! For removal send STOP to 87239 customer services 08708034412
ham,Really good:)dhanush rocks once again:)
ham,"Hello, hello, hi lou sorry it took so long 2 reply- I left mobile at friends in Lancaster, just got it bak Neway im sorry I couldnt make ur bday 2 hun!"
ham,I'm home. Doc gave me pain meds says everything is fine.
ham,Ok i'm coming home now.
ham,May i call You later Pls
ham,Yun ah.now ü wkg where?btw if ü go nus sc. Ü wana specialise in wad?
ham,Carlos is taking his sweet time as usual so let me know when you and patty are done/want to smoke and I'll tell him to haul ass
ham,It means u could not keep ur words.
ham,Please da call me any mistake from my side sorry da. Pls da goto doctor.
ham,"Lol ... Oh no babe, I wont be sliding into your place after midnight, but thanks for the invite"
ham,"I guess that's why you re worried. You must know that there's a way the body repairs itself. And i'm quite sure you shouldn't worry. We'll take it slow. First the tests, they will guide when your ovulation is then just relax. Nothing you've said is a reason to worry but i.ll keep on followin you up."
ham,A lot of this sickness thing going round. Take it easy. Hope u feel better soon. Lol
ham,I'm very happy for you babe ! Woo hoo party on dude!
spam,"Win the newest Harry Potter and the Order of the Phoenix (Book 5) reply HARRY, answer 5 questions - chance to be the first among readers!"
ham,Yup i'm still having coffee wif my frens... My fren drove she'll give me a lift...
ham,Hi darlin im on helens fone im gonna b up the princes 2 nite please come up tb love Kate
ham,Cheers for the message Zogtorius. Ive been staring at my phone for an age deciding whether to text or not.
ham,… and don‘t worry we‘ll have finished by march … ish!
ham,Do you mind if I ask what happened? You dont have to say if it is uncomfortable.
spam,Marvel Mobile Play the official Ultimate Spider-man game (£4.50) on ur mobile right now. Text SPIDER to 83338 for the game & we ll send u a FREE 8Ball wallpaper
ham,Lul im gettin some juicy gossip at the hospital. Two nurses are talking about how fat they are gettin. And one thinks shes obese. Oyea.
ham,Package all your programs well
ham,"Actually fuck that, just do whatever, do find an excuse to be in tampa at some point before january though"
ham,"Love isn't a decision, it's a feeling. If we could decide who to love, then, life would be much simpler, but then less magical"
spam,Freemsg: 1-month unlimited free calls! Activate SmartCall Txt: CALL to No: 68866. Subscriptn3gbp/wk unlimited calls Help: 08448714184 Stop?txt stop landlineonly
ham,"OH MR SHEFFIELD! You wanna play THAT game, okay. You're the boss and I'm the nanny. You give me a raise and I'll give YOU one!!"
ham,He dint tell anything. He is angry on me that why you told to abi.
ham,I've told him that i've returned it. That should i re order it.
spam,Block Breaker now comes in deluxe format with new features and great graphics from T-Mobile. Buy for just £5 by replying GET BBDELUXE and take the challenge
ham,"no, i *didn't* mean to post it. I wrote it, and like so many other times i've ritten stuff to you, i let it sit there. it WAS what i was feeling at the time. I was angry. Before i left, i hit send, then stop. It wasn't there. I checked on my phone when i got to my car. It wasn't there. You said you didn't sleep, you were bored. So why wouldn't THAT be the time to clean, fold laundry, etc.? At least make the bed?"
ham,"How about clothes, jewelry, and trips?"
