Category,Message
ham,Yes ammae....life takes lot of turns you can only sit and try to hold the steering...
ham,"I'm used to it. I just hope my agents don't drop me since i've only booked a few things this year. This whole me in boston, them in nyc was an experiment."
spam,Hi. Customer Loyalty Offer:The NEW Nokia6650 Mobile from ONLY £10 at TXTAUCTION! Txt word: START to No: 81151 & get yours Now! 4T&Ctxt TC 150p/MTmsg
ham,"I can make it up there, squeezed  &lt;#&gt;  bucks out of my dad"
ham,Thanx 4 2day! U r a goodmate I THINK UR RITE SARY! ASUSUAL!1 U CHEERED ME UP! LOVE U FRANYxxxxx
ham,Imagine Life WITHOUT ME... see.. How fast u are searching me?Don't worry.. l'm always there To disturb U.. Goodnoon..:)
ham,Me too watching surya movie only. . .after 6 pm vijay movie POKKIRI
ham,U know we watchin at lido?
ham,I think steyn surely get one wicket:)
ham,You available now? I'm like right around hillsborough &amp;  &lt;#&gt; th
ham,Yo you around? A friend of mine's lookin to pick up later tonight
spam,"You have won ?1,000 cash or a ?2,000 prize! To claim, call09050000327"
ham,Thank you. do you generally date the brothas?
ham,Are you still playing with gautham?
spam,"FREE MESSAGE Activate your 500 FREE Text Messages by replying to this message with the word FREE For terms & conditions, visit www.07781482378.com"
ham,Networking technical support associate.
spam,"Free msg. Sorry, a service you ordered from 81303 could not be delivered as you do not have sufficient credit. Please top up to receive the service."
ham,Merry christmas to u too annie!
ham,Pls clarify back if an open return ticket that i have can be preponed for me to go back to kerala.
ham,Don't forget though that I love you .... And I walk beside you. Watching over you and keeping your heart warm.
ham,Is ur paper in e morn or aft tmr?
ham,You are a big chic. Common. Declare
ham,I not free today i haf 2 pick my parents up tonite...
ham,Its a big difference.  &lt;#&gt;  versus  &lt;#&gt;  every  &lt;#&gt; hrs
ham,Dear where you. Call me
ham,I'm in class. Will holla later
ham,"Princess, is your kitty shaved or natural?"
ham,Guess he wants alone time. We could just show up and watch when they do..
ham,"K, if u bored up just come to my home.."
ham,I emailed yifeng my part oredi.. Can ü get it fr him..
ham,Okie but i scared u say i fat... Then u dun wan me already...
ham,From someone not to smoke when every time I've smoked in the last two weeks is because of you calling or texting me that you wanted to smoke
ham,"Give her something to drink, if she takes it and doesn't vomit then you her temp might drop. If she unmits however let me know."
ham,I think just yourself …Thanks and see you tomo
ham,At what time are you coming.
ham,Ok. Very good. Its all about making that money.
ham,"Kind of. Just missed train cos of asthma attack, nxt one in half hr so driving in. not sure where to park."
ham,K..k..any special today?
ham,I dont know ask to my brother. Nothing problem some thing that. Just i told .
ham,Ok... Ur typical reply...
ham,"Sorry, I'll call later in meeting any thing related to trade please call Arul. &lt;#&gt;"
ham,Lol great now im getting hungry.
ham,ALRITE
spam,"REMINDER FROM O2: To get 2.50 pounds free call credit and details of great offers pls reply 2 this text with your valid name, house no and postcode"
ham,You always make things bigger than they are
ham,Studying. But i.ll be free next weekend.
ham,Mm that time you dont like fun
spam,I'd like to tell you my deepest darkest fantasies. Call me 09094646631 just 60p/min. To stop texts call 08712460324 (nat rate)
ham,Yeah jay's sort of a fucking retard
ham,Hiya. How was last night? I've been naughty and bought myself clothes and very little ... Ready for more shopping tho! What kind of time do you wanna meet?
ham,Okay but i thought you were the expert
spam,Congratulations ur awarded 500 of CD vouchers or 125gift guaranteed & Free entry 2 100 wkly draw txt MUSIC to 87066 TnCs www.Ldew.com1win150ppmx3age16
ham,U repeat e instructions again. Wat's e road name of ur house?
ham,When i have stuff to sell i.ll tell you
ham,You only hate me. You can call any but you didnt accept even a single call of mine. Or even you messaged
ham,In da car park
ham,Ard 530 lor. I ok then message ü lor.
ham,"Hi , where are you? We're at  and they're not keen to go out i kind of am but feel i shouldn't so can we go out tomo, don't mind do you?"
ham,Well its not like you actually called someone a punto. That woulda been worse.
ham,"Sorry battery died, yeah I'm here"
ham,"The word ""Checkmate"" in chess comes from the Persian phrase ""Shah Maat"" which means; ""the king is dead.."" Goodmorning.. Have a good day..:)"
ham,gonna let me know cos comes bak from holiday that day.  is coming. Don't4get2text me  number.
ham,"Yeah, where's your class at?"
ham,Si si. I think ill go make those oreo truffles.
ham,"Alright we'll bring it to you, see you in like  &lt;#&gt;  mins"
spam,You have 1 new message. Call 0207-083-6089
ham,Hey gals.. Anyone of u going down to e driving centre tmr?
ham,"Haha, my friend tyler literally just asked if you could get him a dubsack"
ham,No dear i do have free messages without any recharge. Hi hi hi
ham,Call to the number which is available in appointment. And ask to connect the call to waheed fathima.
ham,if you text on your way to cup stop that should work. And that should be BUS
ham,He telling not to tell any one. If so treat for me hi hi hi
ham,Good evening! this is roger. How are you?
ham,What happen dear tell me
ham,"How long has it been since you screamed, princess?"
ham,"[…] anyway, many good evenings to u! s"
ham,Mine here like all fr china then so noisy.
ham,Just glad to be talking to you.
spam,URGENT! We are trying to contact U. Todays draw shows that you have won a £800 prize GUARANTEED. Call 09050001295 from land line. Claim A21. Valid 12hrs only
ham,"Yeah there's quite a bit left, I'll swing by tomorrow when I get up"
spam,"SMS. ac sun0819 posts HELLO:""You seem cool, wanted to say hi. HI!!!"" Stop? Send STOP to 62468"
ham,Men like shorter ladies. Gaze up into his eyes.
spam,"FREE GAME. Get Rayman Golf 4 FREE from the O2 Games Arcade. 1st get UR games settings. Reply POST, then save & activ8. Press 0 key for Arcade. Termsapply"
ham,Hey what happen de. Are you alright.
ham,In which place do you want da.
ham,Rofl betta invest in some  anti aging products
ham,Well obviously not because all the people in my cool college life went home ;_;
spam,(Bank of Granite issues Strong-Buy) EXPLOSIVE PICK FOR OUR MEMBERS *****UP OVER 300% *********** Nasdaq Symbol CDGT That is a $5.00 per..
ham,Wish u many many returns of the day.. Happy birthday vikky..
ham,What happened in interview?
ham,When are you guys leaving?
ham,Bull. Your plan was to go floating off to IKEA with me without a care in the world. So i have to live with your mess another day.
ham,How are you babes. Hope your doing ok. I had a shit nights sleep. I fell asleep at 5.Im knackered and im dreading work tonight. What are thou upto tonight. X
ham,I was about to do it when i texted. I finished a long time ago and showered and er'ything!
ham,So when you gonna get rimac access
ham,Nothing but we jus tot u would ask cos u ba gua... But we went mt faber yest... Yest jus went out already mah so today not going out... Jus call lor...
spam,Congratulations YOU'VE Won. You're a Winner in our August £1000 Prize Draw. Call 09066660100 NOW. Prize Code 2309.
ham,Ok lor ü reaching then message me.
ham,"Good afternoon, babe. How goes that day ? Any job prospects yet ? I miss you, my love ... *sighs* ... :-("
spam,Your 2004 account for 07XXXXXXXXX shows 786 unredeemed points. To claim call 08719181259 Identifier code: XXXXX Expires 26.03.05
ham,"Babe, I need your advice"
ham,"Haha... Where got so fast lose weight, thk muz go 4 a month den got effect... Gee,later we go aust put bk e weight."
ham,Take some small dose tablet for fever
ham,"I've got ten bucks, jay is being noncomittal"
ham,"K give me a sec, breaking a  &lt;#&gt;  at cstore"
spam,December only! Had your mobile 11mths+? You are entitled to update to the latest colour camera mobile for Free! Call The Mobile Update VCo FREE on 08002986906
ham,Can help u swoop by picking u up from wherever ur other birds r meeting if u want.
ham,Well. You know what i mean. Texting
ham,How. Its a little difficult but its a simple way to enter this place
ham,how are you? I miss you!
ham,That's y i said it's bad dat all e gals know u... Wat u doing now?
ham,Its a great day. Do have yourself a beautiful one.
ham,Hi this is yijue... It's regarding the 3230 textbook it's intro to algorithms second edition... I'm selling it for $50...
ham,"No, its true..k,Do u knw dis no. &lt;#&gt; ?"
ham,I know complain num only..bettr directly go to bsnl offc nd apply for it..
ham,Ü log off 4 wat. It's sdryb8i
ham,Cool. So how come you havent been wined and dined before?
ham,Ya it came a while ago
ham,S..antha num corrct dane
ham,Anything lar...
ham,Dont flatter yourself... Tell that man of mine two pints of carlin in ten minutes please....
ham,Thanx but my birthday is over already.
ham,Hi happy birthday. Hi hi hi hi hi hi hi
ham,No i am not having not any movies in my laptop
ham,Where at were hungry too
ham,Then dun wear jeans lor...
ham,Have a safe trip to Nigeria. Wish you happiness and very soon company to share moments with
ham,Ü v ma fan...
ham,Probably a couple hours tops
ham,Dear i have reache room
ham,K..k...from tomorrow onwards started ah?
ham,U sleeping now.. Or you going to take? Haha.. I got spys wat.. Me online checking n replying mails lor..
ham,"Cool, text me when you're ready"
ham,How's ur paper?
ham,Hey! do u fancy meetin me at 4 at cha  hav a lil beverage on me. if not txt or ring me and we can meet up l8r. quite tired got in at 3 v.pist ;) love Pete x x x
ham,"Yo, you at jp and hungry like a mofo?"
ham,So how many days since then?
ham,Went fast asleep dear.take care.
ham,Have you finished work yet? :)
spam,Babe: U want me dont u baby! Im nasty and have a thing 4 filthyguys. Fancy a rude time with a sexy bitch. How about we go slo n hard! Txt XXX SLO(4msgs)
ham,S s..first time..dhoni rocks...
ham,Squeeeeeze!! This is christmas hug.. If u lik my frndshp den hug me back.. If u get 3 u r cute:) 6 u r luvd:* 9 u r so lucky;) None? People hate u:
ham,There are no other charges after transfer charges and you can withdraw anyhow you like
ham,"Abeg, make profit. But its a start. Are you using it to get sponsors for the next event?"
ham,yes baby! I need to stretch open your pussy!
ham,Oh unintentionally not bad timing. Great. Fingers  the trains play along! Will give fifteen min warning.
ham,S:)s.nervous  &lt;#&gt; :)
ham,Ok i am on the way to home hi hi
ham,"By the way, i've put a skip right outside the front of the house so you can see which house it is. Just pull up before it."
ham,I HAVE A DATE ON SUNDAY WITH WILL!!
ham,That means from february to april i'll be getting a place to stay down there so i don't have to hustle back and forth during audition season as i have since my sister moved away from harlem.
ham,Dun b sad.. It's over.. Dun thk abt it already. Concentrate on ur other papers k.
ham,I love u 2 babe! R u sure everything is alrite. Is he being an idiot? Txt bak girlie
ham,I to am looking forward to all the sex cuddling.. Only two more sleeps
ham,Yeah I imagine he would be really gentle. Unlike the other docs who treat their patients like turkeys.
ham,ok....take care.umma to you too...
ham,"Thank you. And by the way, I just lost."
ham,"Alright omw, gotta change my order to a half8th"
ham,No need to say anything to me. I know i am an outsider
ham,You're not sure that I'm not trying to make xavier smoke because I don't want to smoke after being told I smoke too much?
ham,Yar lor actually we quite fast... Cos da ge slow wat... Haha...
ham,Oh yeah I forgot. U can only take 2 out shopping at once.
ham,Hello! How r u? Im bored. Inever thought id get bored with the tv but I am. Tell me something exciting has happened there? Anything! =/
ham,Oh k :)why you got job then whats up?
ham,We are both fine. Thanks
ham,"Well, I have to leave for my class babe ... You never came back to me ... :-( ... Hope you have a nice sleep, my love"
ham,Fuck babe ... What happened to you ? How come you never came back?
ham,"I can't, I don't have her number!"
ham,Would really appreciate if you call me. Just need someone to talk to.
ham,"Wow. I never realized that you were so embarassed by your accomodations. I thought you liked it, since i was doing the best i could and you always seemed so happy about ""the cave"". I'm sorry I didn't and don't have more to give. I'm sorry i offered. I'm sorry your room was so embarassing."
ham,Hey sexy buns! What of that day? No word from you this morning on YM ... :-( ... I think of you
ham,Okay lor... Wah... like that def they wont let us go... Haha... What did they say in the terms and conditions?
ham,Ladies first and genus second k .
ham,Is it ok if I stay the night here? Xavier has a sleeping bag and I'm getting tired
ham,Send me your id and password
ham,I don't know jack shit about anything or i'd say/ask something helpful but if you want you can pretend that I did and just text me whatever in response to the hypotheticalhuagauahahuagahyuhagga
ham,I donno if they are scorable
ham,Done it but internet connection v slow and can‘t send it. Will try again later or first thing tomo.
ham,Nope... C ü then...
spam,"Had your contract mobile 11 Mnths? Latest Motorola, Nokia etc. all FREE! Double Mins & Text on Orange tariffs. TEXT YES for callback, no to remove from records."
ham,thanks for the temales it was wonderful. Thank. Have a great week.
ham,Not from this campus. Are you in the library?
spam,"Latest Nokia Mobile or iPOD MP3 Player +£400 proze GUARANTEED! Reply with: WIN to 83355 now! Norcorp Ltd.£1,50/Mtmsgrcvd18+"
ham,There generally isn't one. It's an uncountable noun - u in the dictionary. pieces of research?
ham,Thanx 4 sending me home...
ham,Ok which your another number
ham,Sleeping nt feeling well
ham,Hmm ill have to think about it... ok you're forgiven! =D
ham,"Dear, take care. I am just reaching home.love u a lot."
ham,Yes. Rent is very expensive so its the way we save.
ham,"Babe, have you got enough money to pick up bread and milk ? And I'll give you it back when you get home ?"
ham,You dont know you jabo me abi.
ham,No b4 Thursday
ham,I just made some payments so dont have that much. Sorry. Would you want it fedex or the other way.
ham,"Spoke with uncle john today. He strongly feels that you need to sacrifice to keep me here. He's going to call you. When he does, i beg you to just listen. Dont make any promises or make it clear things are not easy. And i need you to please let us work things out. As long as i keep expecting help, my creativity will be stifled so pls just keep him happy, no promises on your part."
ham,No. On the way home. So if not for the long dry spell the season would have been over
ham,Weightloss! No more girl friends. Make loads of money on ebay or something. And give thanks to God.
spam,Do you want a New Nokia 3510i colour phone DeliveredTomorrow? With 300 free minutes to any mobile + 100 free texts + Free Camcorder reply or call 08000930705
ham,I pocked you up there before
ham,"Ya, told..she was asking wats matter?"
ham,"Are you sure you don't mean ""get here, we made you hold all the weed"""
ham,YO YO YO BYATCH WHASSUP?
ham,"Dear,Me at cherthala.in case u r coming cochin pls call bfore u start.i shall also reach accordingly.or tell me which day u r coming.tmorow i am engaged ans its holiday."
ham,Also andros ice etc etc
ham,And I don't plan on staying the night but I prolly won't be back til late
ham,Sure! I am driving but will reach my destination soon.
ham,Lol for real. She told my dad I have cancer
ham,Lol I would but my mom would have a fit and tell the whole family how crazy and terrible I am
ham,I think i've fixed it can you send a test message?
ham,"It's cool, let me know before it kicks off around  &lt;#&gt; , I'll be out and about all day"
ham,2marrow only. Wed at  &lt;#&gt;  to 2 aha.
ham,So u wan 2 come for our dinner tonight a not?
ham,"its cool but tyler had to take off so we're gonna buy for him and drop it off at his place later tonight. Our total order is a quarter, you got enough?"
ham,Mmmm ... Fuck ... Not fair ! You know my weaknesses ! *grins* *pushes you to your knee's* *exposes my belly and pulls your head to it* Don't forget ... I know yours too *wicked smile*
ham,That's my honeymoon outfit. :)
ham,Dude while were makin those weirdy brownies my sister made awesome cookies. I took pics.
ham,Hasn't that been the pattern recently crap weekends?
ham,"Could you not read me, my Love ? I answered you"
spam,As one of our registered subscribers u can enter the draw 4 a 100 G.B. gift voucher by replying with ENTER. To unsubscribe text STOP
ham,Don't fret. I'll buy the ovulation test strips and send them to you. You wont get them til like march. Can you send me your postal address.u'll be alright.Okay.
ham,WOT STUDENT DISCOUNT CAN U GET ON BOOKS?
ham,"Jay wants to work out first, how's 4 sound?"
ham,I just saw ron burgundy captaining a party boat so yeah
spam,Sunshine Quiz! Win a super Sony DVD recorder if you canname the capital of Australia? Text MQUIZ to 82277. B
ham,Howz that persons story
ham,Then u go back urself lor...
ham,"Imagine you finally get to sink into that bath after I have put you through your paces, maybe even having you eat me for a while before I left ... But also imagine the feel of that cage on your cock surrounded by the bath water, reminding you always who owns you ... Enjoy, my cuck"
ham,Ya:)going for restaurant..
ham,Are you available for soiree on June 3rd?
ham,He said i look pretty wif long hair wat. But i thk he's cutting quite short 4 me leh.
ham,Thanks for yesterday sir. You have been wonderful. Hope you enjoyed the burial. MojiBiola
spam,ringtoneking 84484
spam,lyricalladie(21/F) is inviting you to be her friend. Reply YES-910 or NO-910. See her: www.SMS.ac/u/hmmross STOP? Send STOP FRND to 62468
spam,Sorry I missed your call let's talk when you have the time. I'm on 07090201529
ham,"Finally it has happened..! Aftr decades..! BEER is now cheaper than PETROL! The goverment expects us to ""DRINK"". . . But don't ""DRIVE """
spam,"URGENT, IMPORTANT INFORMATION FOR O2 USER. TODAY IS YOUR LUCKY DAY! 2 FIND OUT WHY LOG ONTO HTTP://WWW.URAWINNER.COM THERE IS A FANTASTIC SURPRISE AWAITING FOR YOU"
ham,ME 2 BABE I FEEL THE SAME LETS JUST 4GET ABOUT IT+BOTH TRY +CHEER UP+NOT FIT SOO MUCHXXLOVE U LOCAXX
ham,:-) :-)
ham,They have a thread on the wishlist section of the forums where ppl post nitro requests. Start from the last page and collect from the bottom up.
ham,Do you think i can move  &lt;#&gt;  in a week
ham,Anyway holla at me whenever you're around because I need an excuse to go creep on people in sarasota
ham,Ok. I only ask abt e movie. U wan ktv oso?
ham,Just finished eating. Got u a plate. NOT leftovers this time.
spam,"WELL DONE! Your 4* Costa Del Sol Holiday or £5000 await collection. Call 09050090044 Now toClaim. SAE, TCs, POBox334, Stockport, SK38xh, Cost£1.50/pm, Max10mins"
ham,"CHA QUITEAMUZING THATSCOOL BABE,PROBPOP IN & CU SATTHEN HUNNY 4BREKKIE! LOVE JEN XXX. PSXTRA LRG PORTIONS 4 ME PLEASE "
spam,This msg is for your mobile content order It has been resent as previous attempt failed due to network error Queries to customersqueries@netvision.uk.com
ham,i see. When we finish we have loads of loans to pay
spam,"Loan for any purpose £500 - £75,000. Homeowners + Tenants welcome. Have you been previously refused? We can still help. Call Free 0800 1956669 or text back 'help'"
ham,Hey happy birthday...
spam,Summers finally here! Fancy a chat or flirt with sexy singles in yr area? To get MATCHED up just reply SUMMER now. Free 2 Join. OptOut txt STOP Help08714742804
spam,"Hi this is Amy, we will be sending you a free phone number in a couple of days, which will give you an access to all the adult parties..."
ham,Have you got Xmas radio times. If not i will get it now
ham,Hey pple...$700 or $900 for 5 nights...Excellent location wif breakfast hamper!!!
ham,Hi da:)how is the todays class?
ham,Babe ? I lost you ... Will you try rebooting ?
ham,Please attend the phone:)
ham,I am 6 ft. We will be a good combination!
spam,"Goal! Arsenal 4 (Henry, 7 v Liverpool 2 Henry scores with a simple shot from 6 yards from a pass by Bergkamp to give Arsenal a 2 goal margin after 78 mins."
ham,You still at grand prix?
spam,URGENT! We are trying to contact U. Todays draw shows that you have won a £2000 prize GUARANTEED. Call 09066358361 from land line. Claim Y87. Valid 12hrs only
ham,"Just wondering, the others just took off"
ham,I hope you know I'm still mad at you.
ham,Yes I started to send requests to make it but pain came back so I'm back in bed. Double coins at the factory too. I gotta cash in all my nitros.
ham,Hurt me... Tease me... Make me cry... But in the end of my life when i die plz keep one rose on my grave and say STUPID I MISS U.. HAVE A NICE DAY BSLVYL
ham,Really... I tot ur paper ended long ago... But wat u copied jus now got use? U happy lar... I still haf 2 study :-(
ham,Wat time r ü going to xin's hostel?
ham,Im just wondering what your doing right now?
ham,No * am working on the ringing u thing but have whole houseful of screaming brats so * am pulling my hair out! Loving u
ham,"I can probably come by, everybody's done around  &lt;#&gt;  right?"
ham,Wow didn't think it was that common. I take it all back ur not a freak! Unless u chop it off:-)
ham,Tmr then ü brin lar... Aiya later i come n c lar... Mayb ü neva set properly ü got da help sheet wif ü...
ham,Hey what are you doing. Y no reply pa..
ham,I.ll get there tomorrow and send it to you
spam,88800 and 89034 are premium phone services call 08718711108
spam,UR awarded a City Break and could WIN a £200 Summer Shopping spree every WK. Txt STORE to 88039.SkilGme.TsCs087147403231Winawk!Age16+£1.50perWKsub
ham,Carry on not disturbing both of you
ham,Is there a reason we've not spoken this year? Anyways have a great week and all the best in your exam
ham,I'm leaving my house now...
ham,Poor girl can't go one day lmao
ham,Lol ... I really need to remember to eat when I'm drinking but I do appreciate you keeping me company that night babe *smiles*
ham,I'm turning off my phone. My moms telling everyone I have cancer. And my sister won't stop calling. It hurts to talk. Can't put up with it. See u when u get home. Love u
spam,Customer Loyalty Offer:The NEW Nokia6650 Mobile from ONLY £10 at TXTAUCTION! Txt word: START to No: 81151 & get yours Now! 4T&Ctxt TC 150p/MTmsg
ham,Hello hun how ru? Its here by the way. Im good. Been on 2 dates with that guy i met in walkabout so far. We have to meet up soon. Hows everyone else?
ham,"Dont pack what you can buy at any store.like cereals. If you must pack food, pack gari or something 9ja that you will miss."
ham,"So many people seems to be special at first sight, But only very few will remain special to you till your last sight.. Maintain them till life ends.. take cr da"
ham,God's love has no limit. God's grace has no measure. God's power has no boundaries. May u have God's endless blessings always in ur life...!! Gud ni8
ham,Are u awake? Is there snow there?
ham,Did you show him and wot did he say or could u not c him 4 dust?
ham,"My sister in law, hope you are having a great month. Just saying hey. Abiola"
ham,What you need. You have a person to give na.
ham,"Received, understood n acted upon!"
ham,Just got up. have to be out of the room very soon. …. i hadn't put the clocks back til at 8 i shouted at everyone to get up and then realised it was 7. wahay. another hour in bed.
spam,Back 2 work 2morro half term over! Can U C me 2nite 4 some sexy passion B4 I have 2 go back? Chat NOW 09099726481 Luv DENA Calls £1/minMobsmoreLKPOBOX177HP51FL
spam,FREE entry into our £250 weekly comp just send the word WIN to 80086 NOW. 18 T&C www.txttowin.co.uk
ham,Thought praps you meant another one. Goodo! I'll look tomorrow
ham,You tell what happen dont behave like this to me. Ok no need to say
ham,I can't describe how lucky you are that I'm actually awake by noon
ham,S:-)if we have one good partnership going we will take lead:)
ham,"Fuck babe ... I miss you already, you know ? Can't you let me send you some money towards your net ? I need you ... I want you ... I crave you ..."
spam,XMAS iscoming & ur awarded either £500 CD gift vouchers & free entry 2 r £100 weekly draw txt MUSIC to 87066 TnC www.Ldew.com1win150ppmx3age16subscription
spam,Camera - You are awarded a SiPix Digital Camera! call 09061221066 fromm landline. Delivery within 28 days
ham,HI DARLIN HOW WAS WORK DID U GET INTO TROUBLE? IJUST TALKED TO YOUR MUM ALL MORNING! I HAD A REALLY GOOD TIME LAST NIGHT IM GOIN OUT SOON BUT CALL ME IF U CAN
ham,Please sen :)my kind advice :-)please come here and try:-)
spam,ASKED 3MOBILE IF 0870 CHATLINES INCLU IN FREE MINS. INDIA CUST SERVs SED YES. L8ER GOT MEGA BILL. 3 DONT GIV A SHIT. BAILIFF DUE IN DAYS. I O £250 3 WANT £800
ham,On the way to office da..
ham,When u wana see it then
ham,Wot is u up 2 then bitch?
ham,"Alright, see you in a bit"
ham,Ok
ham,"Good afternoon on this glorious anniversary day, my sweet J !! I hope this finds you happy and content, my Prey. I think of you and send a teasing kiss from across the sea coaxing images of fond souveniers ... You Cougar-Pen"
ham,Yeah my usual guy's out of town but there're definitely people around I know
spam,INTERFLORA - It's not too late to order Interflora flowers for christmas call 0800 505060 to place your order before Midnight tomorrow.
ham,"Multiply the numbers independently and count decimal points then, for the division, push the decimal places like i showed you."
ham,But i haf enuff space got like 4 mb...
