Category,Message
spam,For taking part in our mobile survey yesterday! You can now have 500 texts 2 use however you wish. 2 get txts just send TXT to 80160 T&C www.txt43.com 1.50p
ham,"Sir, waiting for your letter."
ham,Up to ü... Ü wan come then come lor... But i din c any stripes skirt...
ham,Not..tel software name..
ham,Ofcourse I also upload some songs
ham,U can call now...
ham,Want to send me a virtual hug?... I need one
spam,UR GOING 2 BAHAMAS! CallFREEFONE 08081560665 and speak to a live operator to claim either Bahamas cruise of£2000 CASH 18+only. To opt out txt X to 07786200117
ham,Lol I know! Hey someone did a great inpersonation of flea on the forums. I love it!
ham,Check mail.i have mailed varma and kept copy to you regarding membership.take care.insha allah.
ham,Somebody set up a website where you can play hold em using eve online spacebucks
ham,"Also sir, i sent you an email about how to log into the usc payment portal. I.ll send you another message that should explain how things are back home. Have a great weekend."
ham,Awww dat is sweet! We can think of something to do he he! Have a nice time tonight ill probably txt u later cos im lonely :( xxx.
ham,Cos i was out shopping wif darren jus now n i called him 2 ask wat present he wan lor. Then he started guessing who i was wif n he finally guessed darren lor.
ham,Nope. I just forgot. Will show next week
spam,"Urgent Urgent! We have 800 FREE flights to Europe to give away, call B4 10th Sept & take a friend 4 FREE. Call now to claim on 09050000555. BA128NNFWFLY150ppm"
ham,Nokia phone is lovly..
ham,ELLO BABE U OK?
ham,"I'm an actor. When i work, i work in the evening and sleep late. Since i'm unemployed at the moment, i ALWAYS sleep late. When you're unemployed, every day is saturday."
spam,Dear Voucher Holder 2 claim your 1st class airport lounge passes when using Your holiday voucher call 08704439680. When booking quote 1st class x 2
ham,Argh why the fuck is nobody in town ;_;
ham,Yar... I tot u knew dis would happen long ago already.
ham,Thanks for being there for me just to talk to on saturday. You are very dear to me. I cherish having you as a brother and role model.
ham,Not to worry. I'm sure you'll get it.
ham,Huh y lei...
ham,Cbe is really good nowadays:)lot of shop and showrooms:)city is shaping good.
ham,Goodnight da thangam I really miss u dear.
ham,U havent lost me ill always b here 4u.i didnt intend 2 hurt u but I never knew how u felt about me when Iwas+marine&thats what itried2tell urmom.i careabout u
ham,Lol. Well quality aint bad at all so i aint complaining
ham,Already am squatting is the new way of walking
ham,Misplaced your number and was sending texts to your old number. Wondering why i've not heard from you this year. All the best in your mcat. Got this number from my atlanta friends
ham,When're you guys getting back? G said you were thinking about not staying for mcr
ham,Excellent! Are you ready to moan and scream in ecstasy?
ham,"Aldrine, rakhesh ex RTM here.pls call.urgent."
ham,How to Make a girl Happy? It's not at all difficult to make girls happy. U only need to be... 1. A friend 2. Companion 3. Lover 4. Chef . . .  &lt;#&gt; . Good listener  &lt;#&gt; . Organizer  &lt;#&gt; . Good boyfriend  &lt;#&gt; . Very clean  &lt;#&gt; . Sympathetic  &lt;#&gt; . Athletic  &lt;#&gt; . Warm . . .  &lt;#&gt; . Courageous  &lt;#&gt; . Determined  &lt;#&gt; . True  &lt;#&gt; . Dependable  &lt;#&gt; . Intelligent . . .  &lt;#&gt; . Psychologist  &lt;#&gt; . Pest exterminator  &lt;#&gt; . Psychiatrist  &lt;#&gt; . Healer . .  &lt;#&gt; . Stylist  &lt;#&gt; . Driver . . Aaniye pudunga venaam..
ham,"Very hurting n meaningful lines ever: ""I compromised everything for my love, But at d end my love compromised me for everything:-("".. Gud mornin:-)"
ham,K:)k:)what are detail you want to transfer?acc no enough?
ham,You got job in wipro:)you will get every thing in life in 2 or 3 years.
spam,"Eerie Nokia tones 4u, rply TONE TITLE to 8007 eg TONE DRACULA to 8007 Titles: GHOST, ADDAMSFA, MUNSTERS, EXORCIST, TWILIGHT www.getzed.co.uk POBox36504W45WQ 150p"
ham,They r giving a second chance to rahul dengra.
ham,Aslamalaikkum....insha allah tohar beeen muht albi mufti mahfuuz...meaning same here....
ham,Well boy am I glad G wasted all night at applebees for nothing
ham,Its sarcasm.. .nt scarcasim
ham,Full heat pa:-) i have applyed oil pa.
ham,Yo come over carlos will be here soon
ham,For my family happiness..
ham,I'm on the bus. Love you
ham,"Good afternoon sunshine! How dawns that day ? Are we refreshed and happy to be alive? Do we breathe in the air and smile ? I think of you, my love ... As always"
ham,U coming back 4 dinner rite? Dad ask me so i re confirm wif u...
ham,Getting tickets 4 walsall tue 6 th march. My mate is getting me them on sat. ill pay my treat. Want 2 go. Txt bak .Terry
ham,"I keep seeing weird shit and bein all ""woah"" then realising it's actually reasonable and I'm all ""oh"""
ham,Okay... We wait ah
ham,New car and house for my parents.:)i have only new job in hand:)
ham,Near kalainar tv office.thenampet
ham,Just now saw your message.it k da:)
ham,Oooh I got plenty of those!
ham,"My friend, she's studying at warwick, we've planned to go shopping and to concert tmw, but it may be canceled, havn't seen  for ages, yeah we should get together sometime!"
spam,3. You have received your mobile content. Enjoy
ham,"I'm gonna be home soon and i don't want to talk about this stuff anymore tonight, k? I've cried enough today."
ham,Where wuld I be without my baby? The thought alone mite break me and I dont wanna go crazy but everyboy needs his lady xxxxxxxx
ham,Thanks for loving me so. You rock
ham,Are you at work right now ?
ham,Hi..i got the money da:)
ham,Oh ho. Is this the first time u use these type of words
ham,How dare you stupid. I wont tell anything to you. Hear after i wont talk to you:-.
ham,Ok. I.ll do you right later.
ham,K I'll be there before 4.
ham,Sorry da:)i was thought of calling you lot of times:)lil busy.i will call you at noon..
ham,Okay lor... Will they still let us go a not ah? Coz they will not know until later. We drop our cards into the box right?
ham,I wnt to buy a BMW car urgently..its vry urgent.but hv a shortage of  &lt;#&gt; Lacs.there is no source to arng dis amt. &lt;#&gt; lacs..thats my prob
ham,I cant pick the phone right now. Pls send a message
ham,I dont have i shall buy one dear
spam,Reply to win £100 weekly! What professional sport does Tiger Woods play? Send STOP to 87239 to end service
ham,So its to be poking man everyday that they teach you in canada abi! How are you. Just saying hi.
ham,Haf u eaten? Wat time u wan me 2 come?
ham,All day working day:)except saturday and sunday..
ham,GRAN ONLYFOUND OUT AFEW DAYS AGO.CUSOON HONI
ham,I hope your pee burns tonite.
ham,would u fuckin believe it they didnt know i had thurs pre booked off so they re cancelled me AGAIN! that needs to b sacked
ham,Yes. I come to nyc for audiitions and am trying to relocate.
ham,"Once a fishrman woke early in d mrng. It was very dark. He waited a while &amp; found a sack ful of stones. He strtd throwin thm in2 d sea 2 pass time. Atlast he had jus 1stone, sun rose up &amp; he found out tht those r nt stones, those were diamonds. Moral:""Dont wake up early in d mrng'' GOOD night"
ham,Thank u!
ham,K:)eng rocking in ashes:)
spam,URGENT! We are trying to contact you. Last weekends draw shows that you have won a £900 prize GUARANTEED. Call 09061701851. Claim code K61. Valid 12hours only
ham,"Its good, we'll find a way"
ham,This pen thing is beyond a joke. Wont a Biro do? Don't do a masters as can't do this ever again!
ham,"Maybe westshore or hyde park village, the place near my house?"
ham,Today i'm not workin but not free oso... Gee... Thgt u workin at ur fren's shop ?
ham,"Sir, i am waiting for your call, once free please call me."
ham,Then u better go sleep.. Dun disturb u liao.. U wake up then msg me lor..
ham,Change windows logoff sound..
ham,Btw regarding that we should really try to see if anyone else can be our 4th guy before we commit to a random dude
ham,Yay! You better not have told that to 5 other girls either.
ham,I come n pick ü up... Come out immediately aft ur lesson...
ham,Pls send me your address sir.
ham,O i played smash bros  &lt;#&gt;  religiously.
ham,Ok... U enjoy ur shows...
ham,I anything lor...
ham,Or i go home first lar ü wait 4 me lor.. I put down my stuff first..
ham,I've been trying to reach him without success
ham,Bring it if you got it
ham,Sitting ard nothing to do lor. U leh busy w work?
ham,What time should I tell my friend to be around?
ham,"Aight, call me once you're close"
spam,You have won a Nokia 7250i. This is what you get when you win our FREE auction. To take part send Nokia to 86021 now. HG/Suite342/2Lands Row/W1JHL 16+
ham,Pick you up bout 7.30ish? What time are  and that going?
ham,He says hi and to get your ass back to south tampa (preferably at a kegger)
ham,When you guys planning on coming over?
ham,We can go 4 e normal pilates after our intro...
ham,You should know now. So how's anthony. Are you bringing money. I've school fees to pay and rent and stuff like that. Thats why i need your help. A friend in need....|
ham,I'm thinking that chennai forgot to come for auction..
ham,"Fuuuuck I need to stop sleepin, sup"
ham,Do you know where my lab goggles went
ham,Fine i miss you very much.
ham,Fyi I'm gonna call you sporadically starting at like  &lt;#&gt;  bc we are not not doin this shit
ham,"I think your mentor is , but not 100 percent sure."
ham,"Say this slowly.? GOD,I LOVE YOU &amp; I NEED YOU,CLEAN MY HEART WITH YOUR BLOOD.Send this to Ten special people &amp; u c miracle tomorrow, do it,pls,pls do it..."
ham,This girl does not stay in bed. This girl doesn't need recovery time. Id rather pass out while having fun then be cooped up in bed
spam,Married local women looking for discreet action now! 5 real matches instantly to your phone. Text MATCH to 69969 Msg cost 150p 2 stop txt stop BCMSFWC1N3XX
ham,"Hmmm ... I thought we said 2 hours slave, not 3 ... You are late ... How should I punish you ?"
ham,When did dad get back.
ham,Ü come lt 25 n pass to me lar
ham,Doesn't g have class early tomorrow and thus shouldn't be trying to smoke at  &lt;#&gt;
ham,Dunno leh cant remember mayb lor. So wat time r we meeting tmr?
ham,It has issues right now. Ill fix for her by tomorrow.
ham,But i juz remembered i gotta bathe my dog today..
ham,"Haha awesome, omw back now then"
ham,"It,,s a taxt massage....tie-pos argh ok! Lool!"
ham,Ü mean it's confirmed... I tot they juz say oni... Ok then...
spam,"You are a £1000 winner or Guaranteed Caller Prize, this is our Final attempt to contact you! To Claim Call 09071517866 Now! 150ppmPOBox10183BhamB64XE"
ham,U should make a fb list
spam,FREE for 1st week! No1 Nokia tone 4 ur mob every week just txt NOKIA to 8007 Get txting and tell ur mates www.getzed.co.uk POBox 36504 W45WQ norm150p/tone 16+
ham,Love that holiday Monday feeling even if I have to go to the dentists in an hour
ham,O ic lol. Should play 9 doors sometime yo
ham,Lol u still feeling sick?
ham,Don‘t give a flying monkeys wot they think and I certainly don‘t mind. Any friend of mine and all that!
spam,4mths half price Orange line rental & latest camera phones 4 FREE. Had your phone 11mths ? Call MobilesDirect free on 08000938767 to update now! or2stoptxt
spam,"Congrats! 2 mobile 3G Videophones R yours. call 09061744553 now! videochat wid ur mates, play java games, Dload polyH music, noline rentl. bx420. ip4. 5we. 150pm"
ham,"4 tacos + 1 rajas burrito, right?"
spam,Double Mins & Double Txt & 1/2 price Linerental on Latest Orange Bluetooth mobiles. Call MobileUpd8 for the very latest offers. 08000839402 or call2optout/LF56
ham,No problem with the renewal. I.ll do it right away but i dont know his details.
ham,That's y u haf 2 keep me busy...
ham,"Aight text me when you're back at mu and I'll swing by, need somebody to get the door for me"
ham,Can a not?
ham,Miles and smiles r made frm same letters but do u know d difference..? smile on ur face keeps me happy even though I am miles away from u.. :-)keep smiling.. Good nyt
ham,Gudnite....tc...practice going on
ham,She left it very vague. She just said she would inform the person in accounting about the delayed rent and that i should discuss with the housing agency about my renting another place. But checking online now and all places around usc are  &lt;#&gt;  and up
ham,Even my brother is not like to speak with me. They treat me like aids patent.
ham,"Thanks da thangam, i feel very very happy dear. I also miss you da."
spam,"This is the 2nd attempt to contract U, you have won this weeks top prize of either £1000 cash or £200 prize. Just call 09066361921"
ham,what is your account number?
ham,Thank god they are in bed!
ham,Thanks love. But am i doing torch or bold.
ham,"Some friends want me to drive em someplace, probably take a while"
ham,Huh so late... Fr dinner?
ham,I didnt get anything da
spam,"We know someone who you know that fancies you. Call 09058097218 to find out who. POBox 6, LS15HB 150p"
ham,Hey so whats the plan this sat?
ham,Tell dear what happen to you. Why you talking to me like an alian
ham,Are you ok. What happen to behave like this
ham,Yeah sure I'll leave in a min
ham,Havent planning to buy later. I check already lido only got 530 show in e afternoon. U finish work already?
ham,Tessy..pls do me a favor. Pls convey my birthday wishes to Nimya..pls dnt forget it. Today is her birthday Shijas
ham,"Mmmmm ... It was sooooo good to wake to your words this morning, my Love!! Mmmm fuck ... I love you too, my Lion ... *devouring kiss from across the sea*"
ham,I'll text you when I drop x off
ham,Omg if its not one thing its another. My cat has worms :/ when does this bad day end?
ham,"No, I was trying it all weekend ;V"
ham,"Goodmorning, today i am late for 1hr."
spam,"FreeMsg Hey U, i just got 1 of these video/pic fones, reply WILD to this txt & ill send U my pics, hurry up Im so bored at work xxx (18 150p/rcvd STOP2stop)"
ham,You will be in the place of that man
ham,"A famous quote : when you develop the ability to listen to 'anything' unconditionally without losing your temper or self confidence, it means you are ......... 'MARRIED'"
ham,"Haha, that was the first person I was gonna ask"
spam,More people are dogging in your area now. Call 09090204448 and join like minded guys. Why not arrange 1 yourself. There's 1 this evening. A£1.50 minAPN LS278BB
ham,I'm at home n ready...
ham,Oh thanks a lot..i already bought 2 eggs ..
ham,HELLO PEACH! MY CAKE TASTS LUSH!
ham,We walked from my moms. Right on stagwood pass right on winterstone left on victors hill. Address is &lt;#&gt;
ham,Not planned yet :)going to join company on jan 5 only.don know what will happen after that.
ham,"Can meh? Thgt some will clash... Really ah, i dun mind... I dun seen to have lost any weight... Gee..."
ham,"Cant believe i said so many things to you this morning when all i really wanted to say was good morning, i love you! Have a beautiful morning. See you in the library later."
ham,Dont let studying stress you out. L8r.
ham,Shuhui has bought ron's present it's a swatch watch...
ham,"Oh, then your phone phoned me but it disconnected"
ham,Yup i'm elaborating on the safety aspects and some other issues..
ham,Yeah no probs - last night is obviously catching up with you... Speak soon
ham,"So anyways, you can just go to your gym or whatever, my love *smiles* I hope your ok and having a good day babe ... I miss you so much already"
ham,Really dun bluff me leh... U sleep early too. Nite...
ham,Ok pa. Nothing problem:-)
ham,"Hey , is * rite u put »10 evey mnth is that all?"
ham,* Am on my way
ham,"Text me when you get off, don't call, my phones having problems"
ham,I'm doing da intro covers energy trends n pros n cons... Brief description of nuclear fusion n oso brief history of iter n jet got abt 7 n half pages..
spam,"England v Macedonia - dont miss the goals/team news. Txt ur national team to 87077 eg ENGLAND to 87077 Try:WALES, SCOTLAND 4txt/ú1.20 POBOXox36504W45WQ 16+"
ham,Wat r u doing?
ham,I know! Grumpy old people. My mom was like you better not be lying. Then again I am always the one to play jokes...
spam,Filthy stories and GIRLS waiting for your
spam,Loans for any purpose even if you have Bad Credit! Tenants Welcome. Call NoWorriesLoans.com on 08717111821
ham,Babe ? I lost you ... :-(
ham,"Happy new year to u and ur family...may this new year bring happiness , stability and tranquility to ur vibrant colourful life:):)"
ham,"Wat time liao, where still got."
ham,I'm in office now . I will call you  &lt;#&gt;  min:)
ham,(You didn't hear it from me)
ham,What i told before i tell. Stupid hear after i wont tell anything to you. You dad called to my brother and spoken. Not with me.
ham,"Easy mate, * guess the quick drink was bit ambitious."
ham,"No, I decided that only people who care about stuff vote and caring about stuff is for losers"
spam,Do you want a New Nokia 3510i Colour Phone Delivered Tomorrow? With 200 FREE minutes to any mobile + 100 FREE text + FREE camcorder Reply or Call 8000930705
ham,Haven't eaten all day. I'm sitting here staring at this juicy pizza and I can't eat it. These meds are ruining my life.
spam,Check Out Choose Your Babe Videos @ sms.shsex.netUN fgkslpoPW fgkslpo
spam,"SMSSERVICES. for yourinclusive text credits, pls goto www.comuk.net login= 3qxj9 unsubscribe with STOP, no extra charge. help 08702840625.COMUK. 220-CM2 9AE"
ham,I keep ten rs in my shelf:) buy two egg.
spam,Please CALL 08712402972 immediately as there is an urgent message waiting for you
ham,Chk in ur belovd ms dict
ham,ARE YOU IN TOWN? THIS IS V. IMPORTANT
ham,Ok... I din get ur msg...
spam,"our mobile number has won £5000, to claim calls us back or ring the claims hot line on 09050005321."
ham,"K, jason says he's gonna be around so I'll be up there around  &lt;#&gt;"
ham,Hey.. Something came up last min.. Think i wun be signing up tmr.. Hee
ham,Hi where you. You in home or calicut?
ham,Kaiez... Enjoy ur tuition... Gee... Thk e second option sounds beta... I'll go yan jiu den msg u...
spam,EASTENDERS TV Quiz. What FLOWER does DOT compare herself to? D= VIOLET E= TULIP F= LILY txt D E or F to 84025 NOW 4 chance 2 WIN £100 Cash WKENT/150P16+
ham,Is toshiba portege m100 gd?
ham,Idea will soon get converted to live:)
ham,Am in gobi arts college
ham,"Im sorry bout last nite it wasnt ur fault it was me, spouse it was pmt or sumthin! U 4give me? I think u shldxxxx"
ham,Sad story of a Man - Last week was my b'day. My Wife did'nt wish me. My Parents forgot n so did my Kids . I went to work. Even my Colleagues did not wish.
ham,"Right on brah, see you later"
ham,My house here e sky quite dark liao... If raining then got excuse not 2 run already rite... Hee...
ham,"Nt only for driving even for many reasons she is called BBD..thts it chikku, then hw abt dvg cold..heard tht vinobanagar violence hw is the condition..and hw ru ? Any problem?"
ham,I place all ur points on e cultures module already.
ham,"If you want to mapquest it or something look up ""usf dogwood drive"", that's the tiny street where the parking lot is"
ham,"U need my presnts always bcz U cant mis love. ""jeevithathile irulinae neekunna prakasamanu sneham"" prakasam ennal prabha 'That mns prabha is'LOVE' Got it. Dont mis me...."
spam,"500 New Mobiles from 2004, MUST GO! Txt: NOKIA to No: 89545 & collect yours today!From ONLY £1 www.4-tc.biz 2optout 087187262701.50gbp/mtmsg18"
ham,I am in your office na.
ham,He is a womdarfull actor
spam,Ur cash-balance is currently 500 pounds - to maximize ur cash-in now send GO to 86688 only 150p/msg. CC: 08718720201 PO BOX 114/14 TCR/W1
ham,LOOK AT THE FUCKIN TIME. WHAT THE FUCK YOU THINK IS UP
ham,"I'm eatin now lor, but goin back to work soon... E mountain deer show huh... I watch b4 liao, very nice..."
spam,"Gr8 Poly tones 4 ALL mobs direct 2u rply with POLY TITLE to 8007 eg POLY BREATHE1 Titles: CRAZYIN, SLEEPINGWITH, FINEST, YMCA :getzed.co.uk POBox365O4W45WQ 300p"
ham,"Pete,is this your phone still? Its Jenny from college and Leanne.what are you up to now?:)"
spam,"Hungry gay guys feeling hungry and up 4 it, now. Call 08718730555 just 10p/min. To stop texts call 08712460324 (10p/min)"
spam,Ur TONEXS subscription has been renewed and you have been charged £4.50. You can choose 10 more polys this month. www.clubzed.co.uk *BILLING MSG*
ham,Baaaaaaaabe! Wake up ! I miss you ! I crave you! I need you!
ham,Lol boo I was hoping for a laugh
ham,Watching tv lor. Nice one then i like lor.
ham,Alex knows a guy who sells mids but he's down in south tampa and I don't think I could set it up before like 8
ham,Ah poop. Looks like ill prob have to send in my laptop to get fixed cuz it has a gpu problem
ham,Beautiful truth : Expression of the face could Be seen by everyone... But the depression of heart Could be understood only By the Loved ones.. Gud Ni8;-)
ham,Lmao!nice 1
ham,Moji i love you more than words. Have a rich day
ham,Annoying isn't it.
ham,Haiyoh... Maybe your hamster was jealous of million
ham,"Sorry vikky, i'm Watching olave mandara movie kano in trishul theatre wit my frnds.."
ham,K ill drink.pa then what doing. I need srs model pls send it to my mail id pa.
ham,Is xy going 4 e lunch?
spam,You are a winner you have been specially selected to receive £1000 cash or a £2000 award. Speak to a live operator to claim call 087123002209am-7pm. Cost 10p
ham,K:)i will give my kvb acc details:)
ham,"Oh, i will get paid. The most outstanding one is for a commercial i did for Hasbro...in AUGUST! They made us jump through so many hoops to get paid. Still not."
ham,Serious? What like proper tongued her
spam,RGENT! This is the 2nd attempt to contact U!U have WON £1250 CALL 09071512433 b4 050703 T&CsBCM4235WC1N3XX. callcost 150ppm mobilesvary. max£7. 50
ham,Good morning princess! Have a great day!
spam,"u r subscribed 2 TEXTCOMP 250 wkly comp. 1st wk?s free question follows, subsequent wks charged@150p/msg.2 unsubscribe txt STOP 2 84128,custcare 08712405020"
spam,TBS/PERSOLVO. been chasing us since Sept for£38 definitely not paying now thanks to your information. We will ignore them. Kath. Manchester.
ham,"It's fine, imma get a drink or somethin. Want me to come find you?"
ham,Yes..he is really great..bhaji told kallis best cricketer after sachin in world:).very tough to get out.
ham,Cancel cheyyamo?and get some money back?
ham,I.ll post her out l8r. In class
ham,Still i have not checked it da. . .
ham,"Argh my 3g is spotty, anyway the only thing I remember from the research we did was that province and sterling were the only problem-free places we looked at"
ham,God created gap btwn ur fingers so dat sum1 vry special will fill those gaps by holding ur hands.. Now plz dont ask y he created so much gap between legs !!!
ham,"Do whatever you want. You know what the rules are. We had a talk earlier this week about what had to start happening, you showing responsibility. Yet, every week it's can i bend the rule this way? What about that way? Do whatever. I'm tired of having thia same argument with you every week. And a  &lt;#&gt;  movie DOESNT inlude the previews. You're still getting in after 1."
ham,Let there be snow. Let there be snow. This kind of weather brings ppl together so friendships can grow.
ham,1 in cbe. 2 in chennai.
ham,Good sleep is about rhythm. The person has to establish a rhythm that the body will learn and use. If you want to know more :-)
ham,"Nowadays people are notixiquating the laxinorficated opportunity for bambling of entropication.... Have you ever oblisingately opted ur books for the masteriastering amplikater of fidalfication? It is very champlaxigating, i think it is atrocious.. Wotz Ur Opinion???? Junna"
ham,Yeah we do totes. When u wanna?
ham,"said kiss, kiss, i can't do the sound effects! He is a gorgeous man isn't he! Kind of person who needs a smile to brighten his day!"
ham,Pls go ahead with watts. I just wanted to be sure. Do have a great weekend. Abiola
ham,"I'm back &amp; we're packing the car now, I'll let you know if there's room"
ham,"Jolly good! By the way,  will give u tickets for sat eve 7.30. Speak before then x"
ham,No. I dont want to hear anything
ham,HELLO U.CALL WEN U FINISH WRK.I FANCY MEETIN UP WIV U ALL TONITE AS I NEED A BREAK FROM DABOOKS. DID 4 HRS LAST NITE+2 TODAY OF WRK!
ham,Wat makes u thk i'll fall down. But actually i thk i'm quite prone 2 falls. Lucky my dad at home i ask him come n fetch me already.
ham,Morning only i can ok.
ham,have * good weekend.
ham,Sat right? Okay thanks...
spam,"HOT LIVE FANTASIES call now 08707509020 Just 20p per min NTT Ltd, PO Box 1327 Croydon CR9 5WB 0870..k"
ham,I am in escape theatre now. . Going to watch KAVALAN in a few minutes
ham,Nope. Meanwhile she talk say make i greet you.
ham,I am going to sao mu today. Will be done only at 12
ham,"Geeeee ... Your internet is really bad today, eh ?"
ham,You give us back my id proof and  &lt;#&gt;  rs. We wont allow you to work. We will come to your home within days
ham,Or better still can you catch her and let ask her if she can sell  &lt;#&gt;  for me.
spam,Someone has contacted our dating service and entered your phone because they fancy you! To find out who it is call from a landline 09111032124 . PoBox12n146tf150p
ham,But if she.s drinkin i'm ok.
ham,I taught that Ranjith sir called me. So only i sms like that. Becaus hes verifying about project. Prabu told today so only pa dont mistake me..
ham,It is only yesterday true true.
ham,"Hi, my love! How goes that day? Fuck, this morning I woke and dropped my cell on the way down the stairs but it seems alright ... *phews* I miss you !"
ham,Change again... It's e one next to escalator...
ham,Dude avatar 3d was imp. At one point i thought there were actually flies in the room and almost tried hittng one as a reflex
