Category,Message
ham,In xam hall boy asked girl Tell me the starting term for dis answer I can den manage on my own After lot of hesitation n lookin around silently she said THE! intha ponnungale ipaditan;)
ham,I want to be there so i can kiss you and feel you next to me
ham,"Ever green quote ever told by Jerry in cartoon ""A Person Who Irritates u Always Is the one Who Loves u Vry Much But Fails to Express It...!..!! :-) :-) gud nyt"
ham,I think if he rule tamilnadu..then its very tough for our people.
ham,"Ill call u 2mrw at ninish, with my address that icky American freek wont stop callin me 2 bad Jen k eh?"
ham,I wanted to ask ü to wait 4 me to finish lect. Cos my lect finishes in an hour anyway.
ham,Aiyah u did ok already lar. E nydc at wheellock?
ham,I borrow ur bag ok.
ham,if you aren't here in the next  &lt;#&gt;  hours imma flip my shit
ham,What's your room number again? Wanna make sure I'm knocking on the right door
ham,"Dear all, as we know  &lt;#&gt; th is the  &lt;#&gt; th birthday of our loving Gopalettan. We are planning to give a small gift on that day. Those who like to participate in that you are welcome. Please contact our admin team for more details"
ham,Wishing you a wonderful week.
ham,"Ha. You don‘t know either. I did a a clever but simple thing with pears the other day, perfect for christmas."
spam,"Dear Matthew please call 09063440451 from a landline, your complimentary 4*Lux Tenerife holiday or £1000 CASH await collection. ppm150 SAE T&Cs Box334 SK38XH."
ham,Yup but not studying surfing lor. I'm in e lazy mode today.
ham,I'm sick !! I'm needy !! I want you !! *pouts* *stomps feet* Where are you ?! *pouts* *stomps feet* I want my slave !! I want him now !!
ham,That was random saw my old roomate on campus. He graduated
ham,Long time. You remember me today.
ham,Mm you ask him to come its enough :-)
ham,Am okay. Will soon be over. All the best
ham,Beerage?
ham,HEY DAS COOL... IKNOW ALL 2 WELLDA PERIL OF STUDENTFINANCIAL CRISIS!SPK 2 U L8R.
ham,Omg you can make a wedding chapel in frontierville? Why do they get all the good stuff?
ham,"Thk shld b can... Ya, i wana go 4 lessons... Haha, can go for one whole stretch..."
spam,Jamster! To get your free wallpaper text HEART to 88888 now! T&C apply. 16 only. Need Help? Call 08701213186.
ham,"Hello lover! How goes that new job? Are you there now? Are you happy? Do you think of me? I wake, my slave and send you a teasing kiss from across the sea"
ham,What does the dance river do?
ham,"Ah, well that confuses things, doesn‘t it?"
ham,"Get the door, I'm here"
ham,NOT MUCH NO FIGHTS. IT WAS A GOOD NITE!!
ham,X2  &lt;#&gt; . Are you going to get that
ham,"Sorry man my account's dry or I would, if you want we could trade back half or I could buy some shit with my credit card"
ham,Fine am simply sitting.
ham,Have you laid your airtel line to rest?
ham,My drive can only be read. I need to write
ham,Good. do you think you could send me some pix? I would love to see your top and bottom...
ham,K.k.how is your business now?
ham,Come to my home for one last time i wont do anything. Trust me.
ham,Sian... Aft meeting supervisor got work 2 do liao... U working now?
ham,What year. And how many miles.
ham,I tot u reach liao. He said t-shirt.
ham,"Yeah I should be able to, I'll text you when I'm ready to meet up"
ham,I wanted to wish you a Happy New Year and I wanted to talk to you about some legal advice to do with when Gary and I split but in person. I'll make a trip to Ptbo for that. I hope everything is good with you babe and I love ya :)
ham,One day a crab was running on the sea shore..The waves came n cleared the footprints of the crab.. Crab asked: being my frnd y r u clearing my beautiful footprints? Waves replied: A fox was following ur footprints to catch you! thats y i cleared it off:) frndsship never lets u dwn :-) GUD nyt..
ham,You sure your neighbors didnt pick it up
ham,Are you free now?can i call now?
ham,Why you Dint come with us.
ham,"The affidavit says  &lt;#&gt;  E Twiggs St, division g, courtroom  &lt;#&gt; , &lt;TIME&gt;  AM. I'll double check and text you again tomorrow"
ham,CHEERS U TEX MECAUSE U WEREBORED! YEAH OKDEN HUNNY R UIN WK SAT?SOUNDS LIKEYOUR HAVIN GR8FUN J! KEEP UPDAT COUNTINLOTS OF LOVEME XXXXX.
ham,K..k:)how much does it cost?
ham,Its a site to simulate the test. It just gives you very tough questions to test your readiness.
ham,"Ok. Can be later showing around 8-8:30 if you want + cld have drink before. Wld prefer not to spend money on nosh if you don't mind, as doing that nxt wk."
ham,Fwiw the reason I'm only around when it's time to smoke is that because of gas I can only afford to be around when someone tells me to be and that apparently only happens when somebody wants to light up
ham,Feel like trying kadeem again? :V
ham,Well there's a pattern emerging of my friends telling me to drive up and come smoke with them and then telling me that I'm a weed fiend/make them smoke too much/impede their doing other things so you see how I'm hesitant
ham,There is os called ubandu which will run without installing in hard disk...you can use that os to copy the important files in system and give it to repair shop..
ham,"Sir, Waiting for your mail."
ham,Where u been hiding stranger?
ham,"Hiya, probably coming home * weekend after next"
ham,Yeah so basically any time next week you can get away from your mom &amp; get up before 3
ham,Mmm thats better now i got a roast down me! id b better if i had a few drinks down me 2! Good indian?
ham,Mm i had my food da from out
ham,"Sorry, I'll call later In meeting."
ham,Ya but it cant display internal subs so i gotta extract them
ham,Ok i found dis pierre cardin one which looks normal costs 20 its on sale.
ham,Watching tv lor... Y she so funny we bluff her 4 wat. Izzit because she thk it's impossible between us?
ham,Yar he quite clever but aft many guesses lor. He got ask me 2 bring but i thk darren not so willing 2 go. Aiya they thk leona still not attach wat.
ham,"Trust me. Even if isn't there, its there."
ham,I think it's all still in my car
ham,"And how you will do that, princess? :)"
ham,I'm in town now so i'll jus take mrt down later.
ham,K.:)do it at evening da:)urgent:)
spam,We tried to contact you re your reply to our offer of 750 mins 150 textand a new video phone call 08002988890 now or reply for free delivery tomorrow
ham,R u over scratching it?
ham,Too late. I said i have the website. I didn't i have or dont have the slippers
ham,"Hmph. Go head, big baller."
ham,"I just got home babe, are you still awake ?"
ham,Hi kindly give us back our documents which we submitted for loan from STAPATI
ham,Waaaat?? Lololo ok next time then!
ham,Arun can u transfr me d amt
ham,Well i will watch shrek in 3D!!B)
ham,Wait.i will come out.. &lt;#&gt;  min:)
ham,i dnt wnt to tlk wid u
spam,I am hot n horny and willing I live local to you - text a reply to hear strt back from me 150p per msg Netcollex LtdHelpDesk: 02085076972 reply Stop to end
ham,What he said is not the matter. My mind saying some other matter is there.
ham,Hi babe its me thanks for coming even though it didnt go that well!i just wanted my bed! Hope to see you soon love and kisses xxx
ham,Yeah it's jus rite...
spam,"If you don't, your prize will go to another customer. T&C at www.t-c.biz 18+ 150p/min Polo Ltd Suite 373 London W1J 6HL Please call back if busy"
ham,"If you can make it any time tonight or whenever you can it's cool, just text me whenever you're around"
spam,RCT' THNQ Adrian for U text. Rgds Vatian
ham,Of cos can lar i'm not so ba dao ok... 1 pm lor... Y u never ask where we go ah... I said u would ask on fri but he said u will ask today...
spam,Free Top ringtone -sub to weekly ringtone-get 1st week free-send SUBPOLY to 81618-?3 per week-stop sms-08718727870
ham,"Watching cartoon, listening music &amp; at eve had to go temple &amp; church.. What about u?"
ham,That's good. Lets thank God. Please complete the drug. Have lots of water. And have a beautiful day.
ham,Eh u remember how 2 spell his name... Yes i did. He v naughty make until i v wet.
ham,Ok but knackered. Just came home and went to sleep! Not good at this full time work lark.
ham,My sister cleared two round in birla soft yesterday.
ham,They will pick up and drop in car.so no problem..
ham,Wait  &lt;#&gt;  min..
ham,Sounds like you have many talents! would you like to go on a dinner date next week?
ham,"What are you doing in langport? Sorry, but I'll probably be in bed by 9pm. It sucks being ill at xmas! When do you and go2sri lanka?"
ham,Wherre's my boytoy ? :-(
ham,So the sun is anti sleep medicine.
ham,So wats ur opinion abt him and how abt is character?
ham,Then we gotta do it after that
ham,I wil be there with in  &lt;#&gt;  minutes. Got any space
ham,Hai dear friends... This is my new &amp; present number..:) By Rajitha Raj (Ranju)
ham,You also didnt get na hi hi hi hi hi
spam,u r a winner U ave been specially selected 2 receive £1000 cash or a 4* holiday (flights inc) speak to a live operator 2 claim 0871277810710p/min (18 )
ham,Never try alone to take the weight of a tear that comes out of ur heart and falls through ur eyes... Always remember a STUPID FRIEND is here to share... BSLVYL
ham,"Good afternon, my love. How are today? I hope your good and maybe have some interviews. I wake and miss you babe. A passionate kiss from across the sea"
ham,"Why is that, princess? I bet the brothas are all chasing you!"
ham,"Ugh y can't u just apologize, admit u were wrong and ask me to take u back?"
ham,"Me also da, i feel yesterday night  wait til 2day night dear."
ham,Aiyah sorry lor... I watch tv watch until i forgot 2 check my phone.
ham,Hey do you want anything to buy:)
ham,You intrepid duo you! Have a great time and see you both soon.
ham,She's borderline but yeah whatever.
ham,Ok i am on the way to railway
ham,Thank u. IT BETTER WORK OUT CAUSE I WILL FEEL USED OTHERWISE
ham,I've been searching for the right words to thank you for this breather. I promise i wont take your help for granted and will fulfil my promise. You have been wonderful and a blessing at all times.
ham,Ok leave no need to ask
ham,No probably  &lt;#&gt; %.
ham,Does cinema plus drink appeal tomo? * Is a fr thriller by director i like on at mac at 8.30.
ham,I'm at bruce &amp; fowler now but I'm in my mom's car so I can't park (long story)
ham,I cant wait to see you! How were the photos were useful? :)
ham,No..he joined today itself.
ham,Desires- u going to doctor 4 liver. And get a bit stylish. Get ur hair managed. Thats it.
ham,R u still working now?
ham,Great. So should i send you my account number.
ham,At WHAT TIME should i come tomorrow
ham,Can you open the door?
ham,Pls she needs to dat slowly or she will vomit more.
ham,"Haven't seen my facebook, huh? Lol!"
ham,"Come to me right now, Ahmad"
ham,I am back. Good journey! Let me know if you need any of the receipts. Shall i tell you like the pendent?
ham,Is there any training tomorrow?
ham,Hey darlin.. i can pick u up at college if u tell me wen & where 2 mt.. love Pete xx
ham,He is world famamus....
ham,Pansy! You've been living in a jungle for two years! Its my driving you should be more worried about!
ham,Pls help me tell Ashley that i cant find her number oh
spam,"Orange brings you ringtones from all time Chart Heroes, with a free hit each week! Go to Ringtones & Pics on wap. To stop receiving these tips reply STOP."
ham,What is the plural of the noun research?
ham,"Dude u knw also telugu..thts gud..k, gud nyt.."
spam,Had your mobile 11mths ? Update for FREE to Oranges latest colour camera mobiles & unlimited weekend calls. Call Mobile Upd8 on freefone 08000839402 or 2StopTxt
ham,How much are we getting?
ham,You are right. Meanwhile how's project twins comin up
ham,Huh means computational science... Y they like dat one push here n there...
spam,Message Important information for O2 user. Today is your lucky day! 2 find out why log onto http://www.urawinner.com there is a fantastic surprise awaiting you
ham,"Lets use it next week, princess :)"
ham,"Aight, you close by or still down around alex's place?"
ham,Ha... Then we must walk to everywhere... Cannot take tram. My cousin said can walk to vic market from our hotel
ham,When ü login dat time... Dad fetching ü home now?
ham,S but mostly not like that.
ham,Old Orchard near univ. How about you?
ham,You're right I have now that I think about it
ham,Uncle boye. I need movies oh. Guide me. Plus you know torrents are not particularly legal here. And the system is slowing down. What should i do. Have a gr8 day. Plus have you started cos i dont meet you online. How was the honey moon.
ham,Host-based IDPS for linux systems.
ham,Did u fix the teeth?if not do it asap.ok take care.
ham,"Feb  &lt;#&gt;  is ""I LOVE U"" day. Send dis to all ur ""VALUED FRNDS"" evn me. If 3 comes back u'll gt married d person u luv! If u ignore dis u will lose ur luv 4 Evr"
ham,Wah... Okie okie... Muz make use of e unlimited... Haha...
ham,Do you know what Mallika Sherawat did yesterday? Find out now @  &lt;URL&gt;
ham,Was it something u ate?
ham,And do you have any one that can teach me how to ship cars.
spam,Reminder: You have not downloaded the content you have already paid for. Goto http://doit. mymoby. tv/ to collect your content.
ham,LOL ... No just was busy
ham,HARD BUT TRUE: How much you show &amp;  express your love to someone....that much it will hurt when they leave you or you get seperated...!鈥┾??〨ud evening...
spam,Hello. We need some posh birds and chaps to user trial prods for champneys. Can i put you down? I need your address and dob asap. Ta r
ham,Yar but they say got some error.
ham,Meet after lunch la...
ham,Only 2% students solved this CAT question in 'xam... 5+3+2= &lt;#&gt;  9+2+4= &lt;#&gt;  8+6+3= &lt;#&gt;  then 7+2+5=????? Tell me the answer if u r brilliant...1thing.i got d answr.
ham,I REALLY NEED 2 KISS U I MISS U MY BABY FROM UR BABY 4EVA
ham,How will I creep on you now? ;_;
ham,Yes. Nigh you cant aha.
ham,"Hi Chikku, send some nice msgs"
ham,If you still havent collected the dough pls let me know so i can go to the place i sent it to get the control number
spam,"Thanks for your ringtone order, ref number R836. Your mobile will be charged £4.50. Should your tone not arrive please call customer services on 09065069154"
ham,S....s...india going to draw the series after many years in south african soil..
ham,Hey no I ad a crap nite was borin without ya 2 boggy with me u boring biatch! Thanx but u wait til nxt time il ave ya
ham,Ü collecting ur laptop then going to configure da settings izzit?
spam,Thanks for the Vote. Now sing along with the stars with Karaoke on your mobile. For a FREE link just reply with SING now.
ham,"I thought i'd get him a watch, just cos thats the kind of thing u get4an18th. And he loves so much!"
ham,K...k...when will you give treat?
ham,"Sir, I need Velusamy sir's date of birth and company bank facilities details."
spam,Send a logo 2 ur lover - 2 names joined by a heart. Txt LOVE NAME1 NAME2 MOBNO eg LOVE ADAM EVE 07123456789 to 87077 Yahoo! POBox36504W45WQ TxtNO 4 no ads 150p
ham,Am going to take bath ill place the key in window:-)
ham,Yeah but which is worse for i
ham,Same as kallis dismissial in 2nd test:-).
ham,Aft i finish my lunch then i go str down lor. Ard 3 smth lor. U finish ur lunch already?
ham,Lol its ok I didn't remember til last nite
ham,"Rose needs water, season needs change, poet needs imagination..My phone needs ur sms and i need ur lovely frndship forever...."
ham,I can do that! I want to please you both inside and outside the bedroom...
ham,OK i'm waliking ard now... Do u wan me 2 buy anything go ur house?
spam,You will be receiving this week's Triple Echo ringtone shortly. Enjoy it!
spam,New TEXTBUDDY Chat 2 horny guys in ur area 4 just 25p Free 2 receive Search postcode or at gaytextbuddy.com. TXT ONE name to 89693. 08715500022 rpl Stop 2 cnl
ham,G.W.R
ham,If i said anything wrong sorry de:-)
ham,Tell them no need to investigate about me anywhere.
ham,Yes. It's all innocent fun. O:-)
ham,U having lunch alone? I now so bored...
ham,Welp apparently he retired
ham,Busy here. Trying to finish for new year. I am looking forward to finally meeting you...
ham,He also knows about lunch menu only da. . I know
ham,"My planning usually stops at ""find hella weed, smoke hella weed"""
ham,Was actually sleeping and still might when u call back. So a text is gr8. You rock sis. Will send u a text wen i wake.
ham,Reckon need to be in town by eightish to walk from * carpark.
ham,"Aight, we'll head out in a few"
ham,Mom wants to know where you at
ham,Does daddy have a bb now.
ham,"A boy was late 2 home. His father: ""POWER OF FRNDSHIP"""
ham,I can't believe how attached I am to seeing you every day. I know you will do the best you can to get to me babe. I will go to teach my class at your midnight
ham,Whatsup there. Dont u want to sleep
ham,I thk ü gotta go home by urself. Cos i'll b going out shopping 4 my frens present.
spam,"Double Mins & 1000 txts on Orange tariffs. Latest Motorola, SonyEricsson & Nokia with Bluetooth FREE! Call MobileUpd8 on 08000839402 or call2optout/HF8"
ham,Remember on that day..
ham,Got it! It looks scrumptious... daddy wants to eat you all night long!
ham,"I guess you could be as good an excuse as any, lol."
ham,Sounds like a plan! Cardiff is still here and still cold! I'm sitting on the radiator!
ham,I am taking half day leave bec i am not well
ham,Hey i've booked the pilates and yoga lesson already... Haha
ham,See the forwarding message for proof
spam,Money i have won wining number 946 wot do i do next
ham,Watch lor. I saw a few swatch one i thk quite ok. Ard 116 but i need 2nd opinion leh...
ham,"Good FRIENDS CaRE for each Other.. CLoSE Friends UNDERSTaND each Other... and TRUE Friends STaY forever beyond words, beyond time. Gud ni8"
ham,"She said,'' do u mind if I go into the bedroom for a minute ? '' ''OK'', I sed in a sexy mood. She came out 5 minuts latr wid a cake...n My Wife,"
ham,"Sez, hows u & de arab boy? Hope u r all good give my love 2 evry1 love ya eshxxxxxxxxxxx"
ham,I wan but too early lei... Me outside now wun b home so early... Neva mind then...
ham,"Whats that coming over the hill..... Is it a monster! Hope you have a great day. Things r going fine here, busy though!"
ham,Well keep in mind I've only got enough gas for one more round trip barring a sudden influx of cash
ham,K I'll take care of it
ham,"Tell you what, if you make a little spreadsheet and track whose idea it was to smoke to determine who ""smokes too much"" for the entire month of february, I'll come up"
ham,Are there TA jobs available? Let me know please cos i really need to start working
ham,Aiyar hard 2 type. U later free then tell me then i call n scold n tell u.
ham,"Neither [in sterm voice] - i'm studying. All fine with me! Not sure the  thing will be resolved, tho. Anyway. Have a fab hols"
ham,Hey what how about your project. Started aha da.
ham,Dad went out oredi...
ham,For real tho this sucks. I can't even cook my whole electricity is out. And I'm hungry.
ham,True. Its easier with her here.
spam,<Forwarded from 21870000>Hi - this is your Mailbox Messaging SMS alert. You have 40 matches. Please call back on 09056242159 to retrieve your messages and matches cc100p/min
ham,How r ü going to send it to me?
ham,You lifted my hopes with the offer of money. I am in need. Especially when the end of the month approaches and it hurts my studying. Anyways have a gr8 weekend
ham,i am seeking a lady in the street and a freak in the sheets. Is that you?
ham,My supervisor find 4 me one lor i thk his students. I havent ask her yet. Tell u aft i ask her.
ham,"Good afternoon, my love ! Any job prospects ? Are you missing me ? What do you do ? Are you being lazy and bleak, hmmm ? Or happy and filled with my love ?"
ham,How do friends help us in problems? They give the most stupid suggestion that Lands us into another problem and helps us forgt the previous problem
spam,83039 62735=£450 UK Break AccommodationVouchers terms & conditions apply. 2 claim you mustprovide your claim number which is 15541
ham,Buy one egg for me da..please:)
ham,We confirm eating at esplanade?
ham,What's up. Do you want me to come online?
ham,"Night night, see you tomorrow"
ham,I am sorry it hurt you.
ham,Prepare to be pleasured :)
ham,Pls speak to that customer machan.
ham,Me i'm not workin. Once i get job...
ham,I surely dont forgot to come:)i will always be in touch in with you:-)
ham,Have a great trip to India. And bring the light to everyone not just with the project but with everyone that is lucky to see you smile. Bye. Abiola
spam,PRIVATE! Your 2003 Account Statement for shows 800 un-redeemed S. I. M. points. Call 08715203652 Identifier Code: 42810 Expires 29/10/0
ham,Err... Cud do. I'm going to  at 8pm. I haven't got a way to contact him until then.
ham,Jus finish bathing...
ham,No screaming means shouting..
spam,"complimentary 4 STAR Ibiza Holiday or £10,000 cash needs your URGENT collection. 09066364349 NOW from Landline not to lose out! Box434SK38WP150PPM18+"
ham,Thts god's gift for birds as humans hav some natural gift frm god..
ham,Just nw i came to hme da..
ham,Dont worry. I guess he's busy.
ham,Oh. U must have taken your REAL Valentine out shopping first.
ham,Goodo! Yes we must speak friday - egg-potato ratio for tortilla needed!
ham,Do you know when dad will be back?
ham,So now my dad is gonna call after he gets out of work and ask all these crazy questions.
ham,You are a great role model. You are giving so much and i really wish each day for a miracle but God as a reason for everything and i must say i wish i knew why but i dont. I've looked up to you since i was young and i still do. Have a great day.
ham,DO NOT B LATE LOVE MUM
ham,Am i that much bad to avoid like this?
ham,Yeah if we do have to get a random dude we need to change our info sheets to PARTY  &lt;#&gt; /7 NEVER STUDY just to be safe
ham,K da:)how many page you want?
ham,How many licks does it take to get to the center of a tootsie pop?
ham,I will once i get home
ham,Dear i am not denying your words please
ham,How long does it take to get it.
ham,Boo I'm on my way to my moms. She's making tortilla soup. Yummmm
ham,"Come around  &lt;DECIMAL&gt; pm vikky..i'm otside nw, il come by tht time"
spam,"Urgent! call 09066612661 from landline. Your complementary 4* Tenerife Holiday or £10,000 cash await collection SAE T&Cs PO Box 3 WA14 2PX 150ppm 18+ Sender: Hol Offer"
ham,"Aight, I'm chillin in a friend's room so text me when you're on the way"
ham,"They said if its gonna snow, it will start around 8 or 9 pm tonite! They are predicting an inch of accumulation."
ham,Just finished. Missing you plenty
ham,* Am on a train back from northampton so i'm afraid not!
ham,Don know. I did't msg him recently.
ham,Yes but can we meet in town cos will go to gep and then home. You could text at bus stop. And don't worry we'll have finished by march … ish!
ham,Send me the new number
ham,Great! So what attracts you to the brothas?
ham,Both :) i shoot big loads so get ready!
spam,Your unique user ID is 1172. For removal send STOP to 87239 customer services 08708034412
ham,"I got like $ &lt;#&gt; , I can get some more later though. Get whatever you feel like"
ham,He neva grumble but i sad lor... Hee... Buy tmr lor aft lunch. But we still meetin 4 lunch tmr a not. Neva hear fr them lei. Ü got a lot of work ar?
ham,Send me yetty's number pls.
ham,In e msg jus now. U said thanks for gift.
ham,If i not meeting ü all rite then i'll go home lor. If ü dun feel like comin it's ok.
ham,Dip's cell dead. So i m coming with him. U better respond else we shall come back.
ham,"HELLOGORGEOUS, HOWS U? MY FONE WAS ON CHARGE LST NITW WEN U TEXD ME. HOPEU AD A NICE WKEND AS IM SURE U DID LOOKIN 4WARD 2 C-IN U 2MRW LUV JAZ"
spam,"Someone U know has asked our dating service 2 contact you! Cant Guess who? CALL 09058097189 NOW all will be revealed. POBox 6, LS15HB 150p"
ham,You still around? Looking to pick up later
spam,"Our dating service has been asked 2 contact U by someone shy! CALL 09058091870 NOW all will be revealed. POBox84, M26 3UZ 150p"
ham,I'll be late...
ham,Then i buy.
ham,Yup i thk so until e shop closes lor.
ham,"Theoretically yeah, he could be able to come"
ham,"1) Go to write msg 2) Put on Dictionary mode 3)Cover the screen with hand, 4)Press  &lt;#&gt; . 5)Gently remove Ur hand.. Its interesting..:)"
ham,Whom you waited for yesterday
ham,"I jus hope its true that  missin me cos i'm really missin him! You haven't done anything to feel guilty about, yet."
ham,"K.. I yan jiu liao... Sat we can go 4 bugis vill one frm 10 to 3 den hop to parco 4 nb. Sun can go cine frm 1030 to 2, den hop to orc mrt 4 hip hop at 4..."
ham,At home also.
ham,Gd luck 4 ur exams :-)
ham,Free any day but i finish at 6 on mon n thurs...
ham,Lol grr my mom is taking forever with my prescription. Pharmacy is like 2 minutes away. Ugh.
ham,I'm in a movie. Call me 4 wat?
ham,"Sad story of a Man - Last week was my b'day. My Wife did'nt wish me. My Parents forgot n so did my Kids . I went to work. Even my Colleagues did not wish. As I entered my cabin my PA said, '' Happy B'day Boss !!''. I felt special. She askd me 4 lunch. After lunch she invited me to her apartment. We went there. She said,'' do u mind if I go into the bedroom for a minute ? '' ''OK'', I sed in a sexy mood. She came out 5 minuts latr wid a cake...n My Wife, My Parents, My Kidz, My Friends n My Colleagues. All screaming.. SURPRISE !! and I was waiting on the sofa.. ... ..... ' NAKED...!"
spam,"Urgent -call 09066649731from Landline. Your complimentary 4* Ibiza Holiday or £10,000 cash await collection SAE T&Cs PO BOX 434 SK3 8WP 150ppm 18+"
spam,Hard LIVE 121 chat just 60p/min. Choose your girl and connect LIVE. Call 09094646899 now! Cheap Chat UK's biggest live service. VU BCM1896WC1N3XX
